[
  {
    "type": "NOME-A",
    "levels": "N/A",
    "date": "01.02.2025",
    "date_sort": "2025-02-01T00:00:00+02:00",
    "end_date_sort": "2025-02-01T00:00:00+02:00",
    "entry_date": "01.01.-19.01.",
    "location": "Janakkala",
    "coordinates": [
      60.9063816,
      24.6186447
    ],
    "name": "Ilmoittautumiset sähköpostitse!",
    "organizer": "LABRADORINNOUTAJAKERHO R.Y.",
    "official": {
      "name": "",
      "phone": "",
      "email": ""
    },
    "secretary": {
      "name": "",
      "phone": "",
      "email": ""
    },
    "judges": [
      "Ahola Pauliina",
      "Uusimäki Pekka"
    ],
    "description": "Kokeeseen otetaan 10 koiraa, ilmoittautumiset koesihteerille 1.1.-19.1.2025 sähköpostilla: ulla.alhava@gmail.com\n\nLiitä ilmoittautumiseen koiran nimi, rekisterinumero, omistajan nimi, sähköposti ja puhelinnumero.\nIlmoittautumismaksu: 120 € (labradorinnoutajat 100 €)\nKoemaksu maksetaan kun paikka vahvistuu.\n\nKarsinta koesääntöjen ja NOME-A etusijalistan mukaan.",
    "cost": "",
    "cost_member": "",
    "classes": []
  },
  {
    "type": "NOME-A",
    "levels": "N/A",
    "date": "14.02.2025",
    "date_sort": "2025-02-14T22:00:00+00:00",
    "end_date_sort": "2025-02-14T22:00:00+00:00",
    "entry_date": "12.01.-31.01.",
    "location": "Salo",
    "coordinates": [
      60.3879158,
      23.1248694
    ],
    "name": "kansainvälinen",
    "organizer": "SALON SEUDUN NOUTAJAT R.Y.",
    "official": {
      "name": "Mikko Ahti",
      "phone": "050 484 3106",
      "email": ""
    },
    "secretary": {
      "name": "Veera Lempiäinen",
      "phone": "0407419053",
      "email": "veeralempiainen@icloud.com"
    },
    "judges": [
      "Hirvonen Petteri",
      "Sipola Miso",
      "Janice Cunningham (Skotlanti)",
      "Ally Kennedy (Skotlanti)"
    ],
    "description": "Katso tarkemmat tiedot järjestävän yhdistyksen kotisivuilta https://www.salonseudunnoutajat.fi/nou-nome/nou-nome-kokeet/nome-a-kv-15-2-2025/",
    "cost": 120,
    "cost_member": "",
    "classes": []
  },
  {
    "type": "NOME-A",
    "levels": "N/A",
    "date": "15.02.2025",
    "date_sort": "2025-02-15T22:00:00+00:00",
    "end_date_sort": "2025-02-15T22:00:00+00:00",
    "entry_date": "12.01.-31.01.",
    "location": "Salo",
    "coordinates": [
      60.3879158,
      23.1248694
    ],
    "name": "Noviisikoe (epävirallinen harjoituskoe)",
    "organizer": "SALON SEUDUN NOUTAJAT R.Y.",
    "official": {
      "name": "Mikko Ahti",
      "phone": "050 484 3106",
      "email": ""
    },
    "secretary": {
      "name": "Veera Lempiäinen",
      "phone": "0407419053",
      "email": "veeralempiainen@icloud.com"
    },
    "judges": [
      "Hirvonen Petteri",
      "Janice Cunningham (Skotlanti)",
      "Ally Kennedy (Skotlanti)",
      "Sipola Miso"
    ],
    "description": "NOME-A Noviisikoe on Suomessa epävirallinen, mutta monessa muussa Euroopan maassa virallinen koemuoto. Näissä maissa A- tai KV-kokeeseen osallistumiseen vaaditaan noviisikokeesta saatu ykköstulos. \n\nNOME-A Noviisikoe on järjestelyiltään ja tapahtumiltaan samanlainen kuin ”normaali” voittajaluokan NOME-A-koe, mutta noutomatkat pyritään pitämään lyhyempinä ja tehtävät hieman yksinkertaisempina. Koetta voisi luonnehtia myös AVO-luokan A-kokeeksi.\n\nTässä noviisikokeessa on arvostelemassa A-koetuomareita Suomesta ja Skotlannista. Mikäli kokeen päätyttyä jäljellä on vielä riistaa ja valoisaa päivänaikaa, pyritään järjestämään lisänoutoja niille koirille, joiden koe on päättynyt jo aivan alkuvaiheissa. \n\nNoviisikokeesta hyötyy eniten sellainen koira ja ohjaaja, joilla on riittävä koulutus- ja suoritustaso (vähintään ALO1, mieluiten AVO1, NOWT-tai NOME-B-kokeista) ja kokemusta lämpimästä riistasta, mutta ei vielä kokemusta tai ainakaan tuloksia virallisesta A- tai KV-kokeesta. Mikäli ilmoittautumisia tulee enemmän kuin paikkoja on, niin järjestäjä valitsee kokeeseen koirat tulosten ja kokemuksen perusteella.\n\nhttps://www.salonseudunnoutajat.fi/nou-nome/nou-nome-kokeet/nome-a-noviisikoe-16-2-2025/\n",
    "cost": 90,
    "cost_member": "",
    "classes": []
  },
  {
    "type": "NOME-A",
    "levels": "N/A",
    "date": "25.02.2025",
    "date_sort": "2025-02-25T00:00:00+02:00",
    "end_date_sort": "2025-02-25T00:00:00+02:00",
    "entry_date": "20.01.-09.02.",
    "location": "Janakkala",
    "coordinates": [
      60.9063816,
      24.6186447
    ],
    "name": "Ilmoittautumiset sähköpostitse!",
    "organizer": "LABRADORINNOUTAJAKERHO R.Y.",
    "official": {
      "name": "",
      "phone": "",
      "email": ""
    },
    "secretary": {
      "name": "",
      "phone": "",
      "email": ""
    },
    "judges": [
      "Sipola Miso"
    ],
    "description": "Toinen tuomari: Paul O´Brien, Irlanti.\nKokeeseen otetaan 14 koiraa, ilmoittautumiset koesihteerille 20.1.-9.2.2025 sähköpostilla: ulla.alhava@gmail.com Liitä ilmoittautumiseen koiran nimi, rekisterinumero, omistajan nimi, sähköposti ja puhelinnumero. \n\nIlmoittautumismaksu: 120 € (labradorinnoutajat 100 €) Koemaksu maksetaan kun paikka vahvistuu. \nKarsinta koesääntöjen ja NOME-A etusijalistan mukaan.",
    "cost": "",
    "cost_member": "",
    "classes": []
  },
  {
    "type": "NOME-A",
    "levels": "N/A",
    "date": "26.02.2025",
    "date_sort": "2025-02-26T00:00:00+02:00",
    "end_date_sort": "2025-02-26T00:00:00+02:00",
    "entry_date": "20.01.-09.02.",
    "location": "Janakkala",
    "coordinates": [
      60.9063816,
      24.6186447
    ],
    "name": "Ilmoittautumiset sähköpostitse!",
    "organizer": "LABRADORINNOUTAJAKERHO R.Y.",
    "official": {
      "name": "",
      "phone": "",
      "email": ""
    },
    "secretary": {
      "name": "",
      "phone": "",
      "email": ""
    },
    "judges": [
      "Sipola Miso"
    ],
    "description": "Toinen tuomari: Paul O´Brien, Irlanti.\nKokeeseen otetaan 14 koiraa, ilmoittautumiset koesihteerille 20.1.-9.2.2025 sähköpostilla: ulla.alhava@gmail.com Liitä ilmoittautumiseen koiran nimi, rekisterinumero, omistajan nimi, sähköposti ja puhelinnumero. \n\nIlmoittautumismaksu: 120 € (labradorinnoutajat 100 €) Koemaksu maksetaan kun paikka vahvistuu. \nKarsinta koesääntöjen ja NOME-A etusijalistan mukaan.",
    "cost": "",
    "cost_member": "",
    "classes": []
  },
  {
    "type": "EPÄVIRALLINEN",
    "levels": "ALO (Su), AVO (Su)",
    "date": "09.03.2025",
    "date_sort": "2025-03-09T00:00:00+02:00",
    "end_date_sort": "2025-03-09T00:00:00+02:00",
    "entry_date": "17.02.-02.03.",
    "location": "Orimattila",
    "coordinates": [
      60.805137,
      25.7333558
    ],
    "name": "IWT TUKI MÖLLI WT",
    "organizer": "PÄIJÄT-HÄMEEN NOUTAJAKOIRAYHDISTYS",
    "official": {
      "name": "",
      "phone": "",
      "email": ""
    },
    "secretary": {
      "name": "Minna Helenius",
      "phone": "",
      "email": "minna.m.helenius@gmail.com"
    },
    "judges": [
      "",
      "Jyri Toivonen",
      "Pia Kujanpää",
      "Kerolain Filimonova"
    ],
    "description": "Koe on IWT-joukkueen tukikoe. Koe käydään WT-säännöillä ja luokat järjestetään dameilla. Koe täytetään ilmottautumisjärjestyksessä etusijojen jälkeen. Jäsenet ja yhdistyksen tapahtumissa talkoillleet ovat etusijalla. Osallistumisoikeus luokkiin niillä koirilla, joilla ei virallisissa kokeissa ole osallistumisoikeutta ylempään luokkaan. Taipumuskoevaatimusta ei ole.",
    "cost": 40,
    "cost_member": 35,
    "classes": [
      {
        "date": "2025-03-08T22:00:00.000Z",
        "places": 60,
        "entries": 24,
        "members": 13,
        "groups": [
          "ap"
        ],
        "judge": [
          {
            "name": "Pia Kujanpää",
            "official": false,
            "id": -2
          },
          {
            "name": "Jyri Toivonen",
            "official": false,
            "id": -1
          },
          {
            "name": "Kerolain Filimonova",
            "official": false,
            "id": -3
          }
        ],
        "state": "invited",
        "class": "ALO"
      },
      {
        "date": "2025-03-08T22:00:00.000Z",
        "places": 60,
        "entries": 10,
        "members": 5,
        "groups": [
          "ip"
        ],
        "judge": [
          {
            "name": "Pia Kujanpää",
            "official": false,
            "id": -2
          },
          {
            "name": "Jyri Toivonen",
            "official": false,
            "id": -1
          },
          {
            "name": "Kerolain Filimonova",
            "official": false,
            "id": -3
          }
        ],
        "state": "invited",
        "class": "AVO"
      }
    ]
  },
  {
    "type": "KOULUTUS",
    "levels": "N/A",
    "date": "19.03.2025",
    "date_sort": "2025-03-19T00:00:00+02:00",
    "end_date_sort": "2025-03-19T23:59:59.999000+02:00",
    "entry_date": "19.02.-05.03.",
    "location": "Uusimaa",
    "coordinates": [
      60.2246684,
      25.1272631
    ],
    "name": "UMN taipumuskoekurssin etäluentosarja 2025 (19.3 ja 21.3)",
    "organizer": "UUDENMAAN NOUTAJAKOIRAYHDISTYS",
    "official": {
      "name": "",
      "phone": "",
      "email": ""
    },
    "secretary": {
      "name": "Antti Tarkkala",
      "phone": "",
      "email": "nome.umn@umn.fi"
    },
    "judges": [
      "Annina Nurmikivi"
    ],
    "description": "Luennot Ke 19.3.2025 klo 18 alkaen ja Pe 21.3 klo 18 alkaen MS Teamsillä. Kouluttajana on Annina Nurmikivi / Koirakoulu Maltti.\nUMN järjestää keväällä 2025 taipumuskoekurssin hybridimuotoisesti. Kurssin teoriaosuus järjestetään etäluentoina ja maastokoulutukset pienryhmissä lähiopetuksena. Kurssi järjestetään yhteistyössä Koirakoulu Malttin kanssa. \nEtäluennolla käydään läpi taipumuskokeessa vaadittuja noutajan taitoja ja lähiopetuksessa harjoitellaan samoja asioita oman koiran kanssa. Kurssi on tarkoitettu vain UMN:n jäsenille ja jäsenyydet tarkistetaan.\n\nTaipumuskoekurssin maastokoulutuksiin ilmoittaudutaan erikseen ja niihin osallistuminen edellyttää luentosarjaan osallistumisen.",
    "cost": 30,
    "cost_member": 30,
    "classes": []
  },
  {
    "type": "EPÄVIRALLINEN",
    "levels": "ALO (La, Su), AVO (Su)",
    "date": "21.-22.03.2025",
    "date_sort": "2025-03-21T22:00:00+00:00",
    "end_date_sort": "2025-03-22T22:00:00+00:00",
    "entry_date": "03.02.-03.03.",
    "location": "Korpilahti",
    "coordinates": [
      62.0431892,
      25.5801114
    ],
    "name": "",
    "organizer": "MÄNTÄN SEUDUN NUUSKUT R.Y.",
    "official": {
      "name": "",
      "phone": "",
      "email": ""
    },
    "secretary": {
      "name": "Tanja Siltanen",
      "phone": "",
      "email": "siltanentanja@gmail.com"
    },
    "judges": [
      "Anu Pesonen",
      "Anniina Nurmikivi",
      "Sonja Lahdenranta-Husu"
    ],
    "description": "Kaikki luokat järjestetään dameilla.\nHinnat sisältävät keittolounaan. \n\nTalkoolaisille edullisempi osallistumismaksu! Talkoolaiset voivat ilmoittautua: niina.koivula.1@gmail.com.\nJos talkoilet ja olet oikeutettu halvempaan osallistumismaksuun, niin klikkaa itsesi jäseneksi, jolloin halvempi maksu aktivoituu! Talkoilu sovittava Niinan kanssa ENNEN halvemman maksun käyttöä!\n\nKoe täytetään ilmoittautumisjärjestyksessä etusijojen jälkeen. Jäsenet ja kokopäivän talkoilijat ovat etusijalla.\n\nOsallistumisoikeus luokkiin niillä koirilla, joilla ei virallisissa kokeissa ole osallistumisoikeutta ylempään luokkaan. Taipumuskoevaatimusta ei ole. \nKoira voi osallistua vain yhteen luokkaan, ei siis esim. ALO damit la ja ALO damit su molempiin. Ilmoittaudu vain yhteen luokkaan!\nTalvinome on ensisijaisesti yksilökilpailu, joukkuekilpailun joukkueiden koirakot valitaan yksilökilpailuun mukaan mahtuneista koirakoista ja ilmoitetaan kisapaikalla ensimmäisenä vuorossa olevan koirakon toimesta, kokeen toimistossa.\n\nKoesihteeri vastaa sähköpostilla lisäkysymyksiin.\n\nTalvinome instagramissa @talvinome2025\n\nMäntän Seudun Nuuskujen vuosisponsorina sekä Talvinome 2025 tapahtumaa tukemassa SertiLife sekä Biofarm Oy / Aika-tuotteet.",
    "cost": 45,
    "cost_member": 35,
    "classes": [
      {
        "date": "2025-03-21T22:00:00.000Z",
        "places": 47,
        "entries": 85,
        "members": 16,
        "judge": [
          {
            "name": "Anu Pesonen",
            "official": false,
            "id": -1
          },
          {
            "name": "Anniina Nurmikivi",
            "official": false,
            "id": -2
          }
        ],
        "state": "invited",
        "class": "ALO"
      },
      {
        "date": "2025-03-22T22:00:00.000Z",
        "places": 47,
        "entries": 85,
        "members": 16,
        "judge": [
          {
            "name": "Anu Pesonen",
            "official": false,
            "id": -1
          },
          {
            "name": "Anniina Nurmikivi",
            "official": false,
            "id": -2
          }
        ],
        "state": "invited",
        "class": "ALO"
      },
      {
        "date": "2025-03-22T22:00:00.000Z",
        "places": 22,
        "entries": 20,
        "members": 8,
        "judge": [
          {
            "name": "Sonja Lahdenranta-Husu",
            "official": false,
            "id": -3
          }
        ],
        "state": "invited",
        "class": "AVO"
      }
    ]
  },
  {
    "type": "EPÄVIRALLINEN",
    "levels": "N/A",
    "date": "28.03.2025",
    "date_sort": "2025-03-28T00:00:00+02:00",
    "end_date_sort": "2025-03-28T00:00:00+02:00",
    "entry_date": "28.02.-21.03.",
    "location": "Internet",
    "coordinates": [
      61.4269926,
      24.6997491
    ],
    "name": "Wirtuaali-WT 2025 VAIN LAPSI&KOIRA",
    "organizer": "AURAN NUUSKUT RY",
    "official": {
      "name": "",
      "phone": "",
      "email": ""
    },
    "secretary": {
      "name": "Eeva Saario",
      "phone": "",
      "email": "eeva.saario@outlook.com"
    },
    "judges": [
      "Petri Tuominen",
      "Liisa Ewart",
      "Antero Niittymäki",
      "Mari Koivisto",
      "Päivikki Kiuru",
      "Jyri Toivonen"
    ],
    "description": "Wirtuaali-WT on leikkimielinen, epävirallinen tapahtuma, joka alkaa 28.3. ja päättyy 4.5.2025. Joka viikko julkaistaan yksi WT-tyyppinen tehtävä, joka koirakon tulee videoida ja palauttaa järjestäjille Facebookin kautta. Jos sinulla ei ole omaa fb-tiliä, voit sopia palautuksen myös \"kaverin kautta\". Tehtäviä suoritetaan yhteensä 5. \n\nTARKEMMAT TIEDOT TAPAHTUMASTA JA LUOKISTA järjestävän yhdistyksen nettisivuilta, https://www.aurannuuskut.org/nou-nome-wt/kokeet/jasentenvalinen-epavirallinen-no/",
    "cost": 11,
    "cost_member": "",
    "classes": []
  },
  {
    "type": "EPÄVIRALLINEN",
    "levels": "N/A",
    "date": "28.03.2025",
    "date_sort": "2025-03-28T00:00:00+02:00",
    "end_date_sort": "2025-03-28T00:00:00+02:00",
    "entry_date": "28.02.-21.03.",
    "location": "Internet",
    "coordinates": [
      61.4269926,
      24.6997491
    ],
    "name": "Wirtuaali-WT 2025 TULOKKAAT",
    "organizer": "AURAN NUUSKUT RY",
    "official": {
      "name": "",
      "phone": "",
      "email": ""
    },
    "secretary": {
      "name": "Eeva Saario",
      "phone": "",
      "email": "eeva.saario@outlook.com"
    },
    "judges": [
      "Petri Tuominen",
      "Liisa Ewart",
      "Antero Niittymäki",
      "Mari Koivisto",
      "Päivikki Kiuru",
      "Jyri Toivonen"
    ],
    "description": "Wirtuaali-WT on leikkimielinen, epävirallinen tapahtuma, joka alkaa 28.3. ja päättyy 4.5.2025. Joka viikko julkaistaan yksi WT-tyyppinen tehtävä, joka koirakon tulee videoida ja palauttaa järjestäjille Facebookin kautta. Jos sinulla ei ole omaa fb-tiliä, voit sopia palautuksen myös \"kaverin kautta\". Tehtäviä suoritetaan yhteensä 5. \n\nTARKEMMAT TIEDOT TAPAHTUMASTA JA LUOKISTA järjestävän yhdistyksen nettisivuilta, https://www.aurannuuskut.org/nou-nome-wt/kokeet/jasentenvalinen-epavirallinen-no/",
    "cost": 11,
    "cost_member": "",
    "classes": []
  },
  {
    "type": "EPÄVIRALLINEN",
    "levels": "N/A",
    "date": "28.03.2025",
    "date_sort": "2025-03-28T00:00:00+02:00",
    "end_date_sort": "2025-03-28T00:00:00+02:00",
    "entry_date": "28.02.-21.03.",
    "location": "Internet",
    "coordinates": [
      61.4269926,
      24.6997491
    ],
    "name": "Wirtuaali-WT 2025 ALOKKAAT",
    "organizer": "AURAN NUUSKUT RY",
    "official": {
      "name": "",
      "phone": "",
      "email": ""
    },
    "secretary": {
      "name": "Eeva Saario",
      "phone": "",
      "email": "eeva.saario@outlook.com"
    },
    "judges": [
      "Petri Tuominen",
      "Liisa Ewart",
      "Antero Niittymäki",
      "Mari Koivisto",
      "Päivikki Kiuru",
      "Jyri Toivonen"
    ],
    "description": "Wirtuaali-WT on leikkimielinen, epävirallinen tapahtuma, joka alkaa 28.3. ja päättyy 4.5.2025. Joka viikko julkaistaan yksi WT-tyyppinen tehtävä, joka koirakon tulee videoida ja palauttaa järjestäjille Facebookin kautta. Jos sinulla ei ole omaa fb-tiliä, voit sopia palautuksen myös \"kaverin kautta\". Tehtäviä suoritetaan yhteensä 5. \n\nTARKEMMAT TIEDOT TAPAHTUMASTA JA LUOKISTA järjestävän yhdistyksen nettisivuilta, https://www.aurannuuskut.org/nou-nome-wt/kokeet/jasentenvalinen-epavirallinen-no/",
    "cost": 11,
    "cost_member": "",
    "classes": []
  },
  {
    "type": "EPÄVIRALLINEN",
    "levels": "N/A",
    "date": "28.03.2025",
    "date_sort": "2025-03-28T00:00:00+02:00",
    "end_date_sort": "2025-03-28T00:00:00+02:00",
    "entry_date": "28.02.-21.03.",
    "location": "Internet",
    "coordinates": [
      61.4269926,
      24.6997491
    ],
    "name": "Wirtuaali-WT 2025 NOUSUKKAAT",
    "organizer": "AURAN NUUSKUT RY",
    "official": {
      "name": "",
      "phone": "",
      "email": ""
    },
    "secretary": {
      "name": "Eeva Saario",
      "phone": "",
      "email": "eeva.saario@outlook.com"
    },
    "judges": [
      "Petri Tuominen",
      "Liisa Ewart",
      "Antero Niittymäki",
      "Mari Koivisto",
      "Päivikki Kiuru",
      "Jyri Toivonen"
    ],
    "description": "Wirtuaali-WT on leikkimielinen, epävirallinen tapahtuma, joka alkaa 28.3. ja päättyy 4.5.2025. Joka viikko julkaistaan yksi WT-tyyppinen tehtävä, joka koirakon tulee videoida ja palauttaa järjestäjille Facebookin kautta. Jos sinulla ei ole omaa fb-tiliä, voit sopia palautuksen myös \"kaverin kautta\". Tehtäviä suoritetaan yhteensä 5. \n\nTARKEMMAT TIEDOT TAPAHTUMASTA JA LUOKISTA järjestävän yhdistyksen nettisivuilta, https://www.aurannuuskut.org/nou-nome-wt/kokeet/jasentenvalinen-epavirallinen-no/",
    "cost": 11,
    "cost_member": "",
    "classes": []
  },
  {
    "type": "EPÄVIRALLINEN",
    "levels": "N/A",
    "date": "28.03.2025",
    "date_sort": "2025-03-28T00:00:00+02:00",
    "end_date_sort": "2025-03-28T23:59:59.999000+02:00",
    "entry_date": "28.02.-21.03.",
    "location": "Internet",
    "coordinates": [
      61.4269926,
      24.6997491
    ],
    "name": "Wirtuaali-WT 2025 PENNUT",
    "organizer": "AURAN NUUSKUT RY",
    "official": {
      "name": "",
      "phone": "",
      "email": ""
    },
    "secretary": {
      "name": "Eeva Saario",
      "phone": "",
      "email": "eeva.saario@outlook.com"
    },
    "judges": [
      "Petri Tuominen",
      "Liisa Ewart",
      "Antero Niittymäki",
      "Mari Koivisto",
      "Päivikki Kiuru",
      "Jyri Toivonen"
    ],
    "description": "Wirtuaali-WT on leikkimielinen, epävirallinen tapahtuma, joka alkaa 28.3. ja päättyy 4.5.2025. Joka viikko julkaistaan yksi WT-tyyppinen tehtävä, joka koirakon tulee videoida ja palauttaa järjestäjille Facebookin kautta. Jos sinulla ei ole omaa fb-tiliä, voit sopia palautuksen myös \"kaverin kautta\". Tehtäviä suoritetaan yhteensä 5. \n\nTARKEMMAT TIEDOT TAPAHTUMASTA JA LUOKISTA järjestävän yhdistyksen nettisivuilta, https://www.aurannuuskut.org/nou-nome-wt/kokeet/jasentenvalinen-epavirallinen-no/",
    "cost": 11,
    "cost_member": "",
    "classes": []
  },
  {
    "type": "EPÄVIRALLINEN",
    "levels": "N/A",
    "date": "28.03.2025",
    "date_sort": "2025-03-28T00:00:00+02:00",
    "end_date_sort": "2025-03-28T00:00:00+02:00",
    "entry_date": "28.02.-21.03.",
    "location": "Internet",
    "coordinates": [
      61.4269926,
      24.6997491
    ],
    "name": "Wirtuaali-WT 2025 KONKARIT",
    "organizer": "AURAN NUUSKUT RY",
    "official": {
      "name": "",
      "phone": "",
      "email": ""
    },
    "secretary": {
      "name": "Eeva Saario",
      "phone": "",
      "email": "eeva.saario@outlook.com"
    },
    "judges": [
      "Petri Tuominen",
      "Liisa Ewart",
      "Antero Niittymäki",
      "Mari Koivisto",
      "Päivikki Kiuru",
      "Jyri Toivonen"
    ],
    "description": "Wirtuaali-WT on leikkimielinen, epävirallinen tapahtuma, joka alkaa 28.3. ja päättyy 4.5.2025. Joka viikko julkaistaan yksi WT-tyyppinen tehtävä, joka koirakon tulee videoida ja palauttaa järjestäjille Facebookin kautta. Jos sinulla ei ole omaa fb-tiliä, voit sopia palautuksen myös \"kaverin kautta\". Tehtäviä suoritetaan yhteensä 5. \n\nTARKEMMAT TIEDOT TAPAHTUMASTA JA LUOKISTA järjestävän yhdistyksen nettisivuilta, https://www.aurannuuskut.org/nou-nome-wt/kokeet/jasentenvalinen-epavirallinen-no/",
    "cost": 11,
    "cost_member": "",
    "classes": []
  },
  {
    "type": "EPÄVIRALLINEN",
    "levels": "N/A",
    "date": "28.03.2025",
    "date_sort": "2025-03-28T22:00:00+00:00",
    "end_date_sort": "2025-03-28T22:00:00+00:00",
    "entry_date": "17.02.-09.03.",
    "location": "Loppi",
    "coordinates": [
      60.7173615,
      24.4414178
    ],
    "name": "Uudenmaan Ohjus 2025",
    "organizer": "UUDENMAAN NOUTAJAKOIRAYHDISTYS",
    "official": {
      "name": "Pekka Lahti",
      "phone": "",
      "email": ""
    },
    "secretary": {
      "name": "Emmi Merta",
      "phone": "",
      "email": "sihteeri@umn.fi"
    },
    "judges": [
      "Kerolain Filimonova",
      "Pia Kujanpää",
      "Marjaana Kousa"
    ],
    "description": "Osallistumisoikeus on rekisteröidyillä noutajilla, joita ei ole palkittu noutajien metsästyskokeissa, kuitenkin niin, että etuoikeus on nuorilla koirilla (NOU1-tulos on sallittu). Osallistumisoikeus on koirilla, jotka ovat maksimissaan 2 vuotta (alaikäraja 9 kk). Ilmoittautumalla kokeeseen hyväksyn, että kokeen järjestämisen vastuuhenkilöt voivat käsitellä ilmoittamiani henkilötietoja ja julkaista niitä tarpeen mukaisesti ja soveltuvin osin kokeen osallistuja- ja tulosluettelossa koepaikalla ja kokeeseen liittyvissä julkaisuissa internetissä tai muissa yhdistyksen medioissa. Lisätietoja UMN:n tietosuojasta osoitteessa http://www.umn.fi/jasenasiat/tietosuojaseloste/",
    "cost": 35,
    "cost_member": 30,
    "classes": []
  },
  {
    "type": "EPÄVIRALLINEN",
    "levels": "ALO (Su), AVO (Su)",
    "date": "29.03.2025",
    "date_sort": "2025-03-29T22:00:00+00:00",
    "end_date_sort": "2025-03-29T22:00:00+00:00",
    "entry_date": "17.02.-09.03.",
    "location": "Loppi",
    "coordinates": [
      60.7173615,
      24.4414178
    ],
    "name": "Mölli-WT",
    "organizer": "UUDENMAAN NOUTAJAKOIRAYHDISTYS",
    "official": {
      "name": "Pekka Lahti",
      "phone": "",
      "email": ""
    },
    "secretary": {
      "name": "Johanna Ruohonen",
      "phone": "",
      "email": "jspruohonen@gmail.com "
    },
    "judges": [
      "Eeva Toivonen",
      "Antti Tarkkala",
      "Konsta Niiranen"
    ],
    "description": "UMN:n ja Kiharakerhon yhteistyössä järjestämä epävirallinen WT-koe kaikille yli 9kk ikäisille rekisteröidyille noutajille. Kokeessa olevien luokkien (ALO, AVO) taso on hieman helpotetumpi verrattuna virallisten luokkien vastaavaan tasoon. Alokasluokassa koira saa olla heittojen ajan taluttimessa, mutta suorituksesta vähennetään tällöin muutama piste. Kokeessa on kolme rastimuotoista tehtävää. Ei taipumuskoevaatimusta! Alokasluokkaan osallistuvalla koiralla ei saa olla avoimeen luokkaan oikeuttavaa tulosta. Kokeessa noudatetaan Kennelliiton rokotusmääräyksiä sekä antidopingsääntöjä. \n\nLisätietoja UMN:n tietosuojasta osoitteessa http://www.umn.fi/jasenasiat/tietosuojaseloste/",
    "cost": 35,
    "cost_member": 30,
    "classes": [
      {
        "date": "2025-03-29T22:00:00.000Z",
        "entries": 52,
        "judge": [
          {
            "name": "Eeva Toivonen",
            "official": false,
            "id": -1
          },
          {
            "name": "Antti Tarkkala",
            "official": false,
            "id": -2
          },
          {
            "name": "Konsta Niiranen",
            "official": false,
            "id": -3
          }
        ],
        "state": "invited",
        "class": "ALO",
        "members": 36
      },
      {
        "date": "2025-03-29T22:00:00.000Z",
        "entries": 10,
        "judge": [
          {
            "name": "Eeva Toivonen",
            "official": false,
            "id": -1
          },
          {
            "name": "Antti Tarkkala",
            "official": false,
            "id": -2
          },
          {
            "name": "Konsta Niiranen",
            "official": false,
            "id": -3
          }
        ],
        "state": "invited",
        "class": "AVO",
        "members": 6
      }
    ]
  },
  {
    "type": "EPÄVIRALLINEN",
    "levels": "N/A",
    "date": "04.04.2025",
    "date_sort": "2025-04-04T21:00:00+00:00",
    "end_date_sort": "2025-04-04T21:00:00+00:00",
    "entry_date": "21.02.-22.03.",
    "location": "Pälkäne",
    "coordinates": [
      61.3371322,
      24.2649422
    ],
    "name": "Pirkan Damit",
    "organizer": "PIRKANMAAN NOUTAJAKOIRAYHDISTYS RY",
    "official": {
      "name": "Heidi Lamminen",
      "phone": "",
      "email": ""
    },
    "secretary": {
      "name": "Mirva Kausiala",
      "phone": "",
      "email": ""
    },
    "judges": [
      "Elina Kestilä-Kekkonen ",
      "Vesa Saviahde ",
      "Raija Marttila ",
      "Annukka Näsinlinna ",
      "Anna Elonen ",
      "Jukka Kurkela"
    ],
    "description": "Kaikkiin sarjoihin ilmoittaudutaan Pirkanmaan Noutajakoirayhdistyksen nettisivuilla olevalla lomakkeella osoitteessa https://www.pirkannuusku.net/nome/pirkan-damit/pirkan-damit-2025/\n \nMaksu tapahtuu yhdistyksen tilille FI42 5620 0920 7360 62 käyttäen viitenumeroa 10032, pirkandamit@pirkannuusku.net - sähköpostista voi kysyä tapahtumasta. \n \nSarjat: \n-Yksilökilpailu, osallistuva koira ei saa olla osallistunut rodunomaisten kokeiden (nome-b, wt) avoimeen luokkaan, ikärajaa ei ole.\n-Kenneljoukkueet, (koiran ikä alle 22kk), koulutus on tarkoitettu 5.6.2023 jälkeen syntyneille koirille, joka ei ole startannu avoimessa luokassa.\n-Yhdistysjoukkueet tai muut joukkueet (koiran ikä alle 22kk) Koulutus on tarkoitettu 5.6.2023 jälkeen syntyneille koirille, joka ei ole startannut avoimessa luokassa.\n- Koira&Lapsi (lapsi alle 12v). \n- Veteraaniluokat 8-9vuotiaat.\n- Veteraanit 10v täyttäneet.",
    "cost": 35,
    "cost_member": "",
    "classes": []
  },
  {
    "type": "KOULUTUS",
    "levels": "ALO (Su), AVO (Su), VOI (Su)",
    "date": "06.04.2025",
    "date_sort": "2025-04-06T00:00:00+03:00",
    "end_date_sort": "2025-04-06T00:00:00+03:00",
    "entry_date": "19.02.-05.03.",
    "location": "Uusimaa",
    "coordinates": [
      60.2246684,
      25.1272631
    ],
    "name": "UMN taipumuskoekurssin maastokoulutus 2025 (6.4, 12.4 ja 10.5)",
    "organizer": "UUDENMAAN NOUTAJAKOIRAYHDISTYS",
    "official": {
      "name": "",
      "phone": "",
      "email": ""
    },
    "secretary": {
      "name": "Antti Tarkkala",
      "phone": "",
      "email": "nome.umn@umn.fi"
    },
    "judges": [
      "Annina Nurmikivi"
    ],
    "description": "UMN järjestää keväällä 2025 taipumuskoekurssin hybridimuotoisesti. Kurssin teoriaosuus järjestetään etäluentoina ja maastokoulutukset pienryhmissä lähiopetuksena. Kurssi järjestetään yhteistyössä Koirakoulu Malttin kanssa. \nKurssi on tarkoitettu vain UMN:n jäsenille ja jäsenyydet tarkistetaan.\n\nKurssin lähiopetus toteutetaan pienryhmissä Koirakoulu Maltti:n johdolla. Paikkoja koulutusryhmiin on saatavilla rajoitetusti. Lähiopetukseen osallistuminen edellyttää myös taipumuskokeen teoriaosuuden etäluentoihin osallistumista.  Lähiopetus järjestetään pääkaupunkiseudulla / kehyskunnissa. Huomioithan , että koulutuspaikalle pääsemiksi tarvitset oman auton.\n\nLähiopetuksessa harjoitellaan taipumuskoetta varten oman koiran kanssa ja kerrataan etäopetuksessa kartutettuja taitoja. Koulutus toteutetaan pääosin dameilla, jonka lisäksi koirilla on myös mahdollisuus tutustua taipumuskokeessa yleisesti käytössä oleviin riistalajeihin.\n\nTaipumuskoekurssin lähiopetus pienryhmissä sunnuntaina 6.4., lauantaina 12.4 ja lauantaina 10.5.2025\nRyhmä 1 aamupäivä (ilmoittaudu ALO luokkavalinnalla)\nRyhmä 2 iltapäivä (ilmoittaudu AVO luokkavalinnalla)\nRyhmä 3 alkuilta (ilmoittaudu VOI luokkavalinnalla)\n\nRyhmäjako ja kurssille mahtuminen vahvistetaan ilmoittautuneille ilmoittaumisajan päätyttyä. Kerrothan lisätiedoissa, jos ryhmävalinnan suhteen on joustoa ja sinulle sopii jokin muukin ryhmä kuin valittu.\n",
    "cost": 80,
    "cost_member": 80,
    "classes": [
      {
        "date": "2025-04-05T21:00:00.000Z",
        "places": 28,
        "entries": 28,
        "members": 28,
        "groups": [
          "kp"
        ],
        "judge": [
          {
            "name": "Annina Nurmikivi",
            "official": false,
            "id": -1
          }
        ],
        "state": "invited",
        "class": "ALO"
      },
      {
        "date": "2025-04-05T21:00:00.000Z",
        "places": 0,
        "entries": 0,
        "members": 0,
        "groups": [
          "kp"
        ],
        "judge": [
          {
            "name": "Annina Nurmikivi",
            "official": false,
            "id": -1
          }
        ],
        "class": "AVO"
      },
      {
        "date": "2025-04-05T21:00:00.000Z",
        "places": 0,
        "entries": 0,
        "members": 0,
        "groups": [
          "kp"
        ],
        "judge": [
          {
            "name": "Annina Nurmikivi",
            "official": false,
            "id": -1
          }
        ],
        "class": "VOI"
      }
    ]
  },
  {
    "type": "NOWT",
    "levels": "ALO (La), AVO (La), VOI (La)",
    "date": "11.04.2025",
    "date_sort": "2025-04-11T21:00:00+00:00",
    "end_date_sort": "2025-04-11T21:00:00+00:00",
    "entry_date": "28.02.-21.03.",
    "location": "Orimattila",
    "coordinates": [
      60.805137,
      25.7333558
    ],
    "name": "",
    "organizer": "PAKAANSEUDUN METSÄSTYSSEURA RY",
    "official": {
      "name": "Carita Lifländer",
      "phone": "0407191033",
      "email": "carita.liflander@me.com"
    },
    "secretary": {
      "name": "Saila Avaz",
      "phone": "",
      "email": "saila.avaz@gmail.com"
    },
    "judges": [
      "Salo Mervi",
      "Ronkainen Reima",
      "Lähteenaro Janne",
      "Torila Mika"
    ],
    "description": "Maksu tilille FI08 5308 0750 0146 96 Pakaan Seudun Ms",
    "cost": 40,
    "cost_member": "",
    "classes": [
      {
        "date": "2025-04-11T21:00:00.000Z",
        "entries": 25,
        "judge": [],
        "state": "invited",
        "class": "ALO",
        "members": 0
      },
      {
        "date": "2025-04-11T21:00:00.000Z",
        "entries": 24,
        "judge": [],
        "state": "invited",
        "class": "AVO",
        "members": 0
      },
      {
        "date": "2025-04-11T21:00:00.000Z",
        "entries": 39,
        "judge": [],
        "state": "invited",
        "class": "VOI",
        "members": 0
      }
    ]
  },
  {
    "type": "NOWT",
    "levels": "ALO (Su), AVO (Su), VOI (Su)",
    "date": "13.04.2025",
    "date_sort": "2025-04-13T00:00:00+03:00",
    "end_date_sort": "2025-04-13T00:00:00+03:00",
    "entry_date": "01.03.-22.03.",
    "location": "Orimattila",
    "coordinates": [
      60.805137,
      25.7333558
    ],
    "name": "",
    "organizer": "PÄIJÄT-HÄMEEN NOUTAJAKOIRAYHDISTYS",
    "official": {
      "name": "Maarit Martikainen",
      "phone": "",
      "email": ""
    },
    "secretary": {
      "name": "Mari Olkkonen",
      "phone": "",
      "email": "happyhunt68@outlook.com"
    },
    "judges": [
      "Ronkainen Reima",
      "Uusimäki Pekka",
      "Vitikka Minja",
      "Särkänlahti Jari"
    ],
    "description": "Etusija Päijät-Hämeen Noutajakoirayhdistyksen jäsenillä ja sekä edellemainittujen kokeissa talkoilleilla (koe anotaan \"etusijalla järjestäjän kutsumat koirat\". Näitä voi olla 1/3 kokeen osallistujista.) Jäsenyys oltava voimassa ilmoittautumisajan alkaessa.\n\nKoemaksu palautetaan koepaikan saaneille (arvonnasta tai varasijalta) vain Kennelliiton sääntöjen määräämästä syystä. Tällaisia syitä ovat koiran sairaus, ohjaajan sairaus tai narttukoiralla alkanut kiima.",
    "cost": 45,
    "cost_member": 35,
    "classes": [
      {
        "date": "2025-04-12T21:00:00.000Z",
        "entries": 34,
        "places": 39,
        "members": 13,
        "judge": [],
        "state": "invited",
        "class": "ALO"
      },
      {
        "date": "2025-04-12T21:00:00.000Z",
        "entries": 21,
        "places": 23,
        "members": 6,
        "judge": [],
        "state": "invited",
        "class": "AVO"
      },
      {
        "date": "2025-04-12T21:00:00.000Z",
        "entries": 32,
        "places": 36,
        "members": 7,
        "judge": [],
        "state": "invited",
        "class": "VOI"
      }
    ]
  },
  {
    "type": "KOULUTUS",
    "levels": "N/A",
    "date": "23.04.2025",
    "date_sort": "2025-04-23T00:00:00+03:00",
    "end_date_sort": "2025-04-23T23:59:59.999000+03:00",
    "entry_date": "01.04.-13.04.",
    "location": "Kanta-Häme",
    "coordinates": [
      60.9376961,
      24.1531919
    ],
    "name": "Taipparikurssi",
    "organizer": "KANTA-HÄMEEN NOUTAJAKOIRAYHDISTYS RY",
    "official": {
      "name": "",
      "phone": "",
      "email": "nome@khn.fi"
    },
    "secretary": {
      "name": "",
      "phone": "",
      "email": "nome@khn.fi"
    },
    "judges": [
      "Erkki Peltonen, Pertti Jyrämö, Viivi Poltinoja"
    ],
    "description": "Taipparikurssilla käydään läpi taipumuskokeessa tarvittavat taidot. Pääosa harjoituksista tehdään dameilla, mutta riistaankin pääsee tutustumaan. Kouluttajina toimivat Erkki Peltonen, Pertti Jyrämö, Viivi Poltinoja sekä muut KHN:n aktiivit.\n\nEnnen kurssin alkua pidetään alkutilanteen katsastus ke 23.4. klo 18 Kirstulan kentällä Hämeenlinnassa. Alkutilanteen katsastuksessa katsotaan, miten koirakolta sujuu luoksetulo, damin kantaminen ja palauttaminen ohjaajan läheisyyteen eli lajiharjoittelussa tarvittavat perustaidot.\n\nTaipparikurssi käynnistyy ma 28.4. klo 18–20 Tiina Mursulan pitämällä aloitusluennolla. Luento pidetään Etelä-Hämeen Kennelpiirin tiloissa Hämeenlinnassa. Samalla sovitaan pienryhmien maastoharjoitusajankohdat ja -paikat. Pienryhmät kokoontuvat omien vetäjiensä johdolla 4–5 kertaa kevään aikana.\n\nKurssin hinta on 60 €/koirakko ja se on tarkoitettu KHN:n jäsenille. Kurssille on rajoitettu määrä koirakkopaikkoja. Etusijalla ovat ensikertalaiset. Ilmoita ilmoittautumisen lisätiedoissa, oletko aikaisemmin kouluttanut koiran NOU1-tulokseen. Osallistujavalinnat ilmoitetaan henkilökohtaisesti sähköpostitse tasokokeen jälkeen. Kurssia koskevat tiedustelut: nome@khn.fi\n\nIlmoittaudu kurssille SNJ:n koekalenterissa viimeistään su 13.4.2024\n",
    "cost": 60,
    "cost_member": "",
    "classes": []
  },
  {
    "type": "NOWT",
    "levels": "ALO (La), AVO (La), VOI (La)",
    "date": "25.-26.04.2025",
    "date_sort": "2025-04-25T21:00:00+00:00",
    "end_date_sort": "2025-04-26T20:59:59.999000+00:00",
    "entry_date": "14.03.-04.04.",
    "location": "Peräseinäjoki",
    "coordinates": [
      62.5621248,
      23.0632748
    ],
    "name": "Lakeuden noutajien WT-mestaruus",
    "organizer": "LAKEUDEN NOUTAJAKOIRAYHDISTYS RY",
    "official": {
      "name": "Jari Hietaranta",
      "phone": "0406671888",
      "email": "jari.hietaranta@gmail.com"
    },
    "secretary": {
      "name": "Heidi Silen",
      "phone": "",
      "email": "heidi.silen@lakeudennoutajat.fi"
    },
    "judges": [
      "Schön Esa",
      "Montonen Mikael"
    ],
    "description": "Lakeuden noutajien WT-mestaruus koe.\n\nEtusija järjestävän yhdistyksen jäsenillä sekä yhdistyksen kokeissa talkoilleilla. \n\nJäsenten osallistumismaksu 40 €, ei jäsenten 45 €. Koemaksu palautetaan koepaikan saaneille vain Kennelliiton sääntöjen määräämästä syystä. Tällaisia syitä ovat koiran sairaus, ohjaajan sairaus tai narttukoiralla alkanut kiima. ",
    "cost": 45,
    "cost_member": 40,
    "classes": [
      {
        "date": "2025-04-25T21:00:00.000Z",
        "places": 0,
        "entries": 15,
        "members": 10,
        "judge": [],
        "state": "invited",
        "class": "ALO"
      },
      {
        "date": "2025-04-25T21:00:00.000Z",
        "places": 0,
        "entries": 8,
        "members": 4,
        "judge": [],
        "state": "invited",
        "class": "AVO"
      },
      {
        "date": "2025-04-25T21:00:00.000Z",
        "places": 0,
        "entries": 19,
        "members": 5,
        "judge": [],
        "state": "invited",
        "class": "VOI"
      }
    ]
  },
  {
    "type": "EPÄVIRALLINEN",
    "levels": "ALO (La)",
    "date": "26.04.2025",
    "date_sort": "2025-04-26T00:00:00+03:00",
    "end_date_sort": "2025-04-26T23:59:59.999000+03:00",
    "entry_date": "30.03.-16.04.",
    "location": "Oulunsalo",
    "coordinates": [
      64.9333388,
      25.4166674
    ],
    "name": "Hankinome",
    "organizer": "OULUN SEUDUN NOUTAJAKOIRAYHD. R.Y.",
    "official": {
      "name": "",
      "phone": "",
      "email": ""
    },
    "secretary": {
      "name": "Piia Kipinä",
      "phone": "",
      "email": "piia.k4@gmail.com"
    },
    "judges": [
      "Hatunen Jarmo",
      "Hemmilä Teija",
      "Tenhonen Tanja",
      "Gärding Raija",
      "Mönttinen Oona"
    ],
    "description": "Ilmoittautumisaikaa jatkettu 16.4. saakka. Epävirallinen dameilla suoritettava rastityyppinen koe. Koiralla ei tarvitse olla luokkaan oikeuttavia tuloksia virallisissa rodunomaisissa kokeissa. \nHUOM! Kokeessa myös luokka ”Veteraanit”, alaikäraja 10 vuotta. Ilmoittautuessa veteraaniluokkaan, ilmoittaudutaan ALO-luokkaan ja kirjataan lisätietoja kohtaan maininta ”osallistuu veteraaniluokkaan”. \nTapahtumassa järjestetään myös joukkuekilpailu: 3 koiraa/joukkue, koirat voivat olla eri luokista. Joukkuekilpailuun ilmoittaudutaan kirjaamalla lisätietoihin joukkueen nimi.\nMuutokset (tuomarit, arvosteluluokat) ovat mahdollisia.\n",
    "cost": 30,
    "cost_member": 25,
    "classes": [
      {
        "date": "2025-04-25T21:00:00.000Z",
        "entries": 31,
        "judge": [
          {
            "name": "Hatunen Jarmo",
            "official": false,
            "id": -1
          },
          {
            "name": "Hemmilä Teija",
            "official": false,
            "id": -2
          },
          {
            "name": "Tenhonen Tanja",
            "official": false,
            "id": -3
          },
          {
            "name": "Gärding Raija",
            "official": false,
            "id": -4
          },
          {
            "name": "Mönttinen Oona",
            "official": false,
            "id": -5
          }
        ],
        "state": "invited",
        "class": "ALO",
        "members": 0
      }
    ]
  },
  {
    "type": "NOWT",
    "levels": "ALO (Su), AVO (Su), VOI (Su)",
    "date": "27.04.2025",
    "date_sort": "2025-04-27T00:00:00+03:00",
    "end_date_sort": "2025-04-27T00:00:00+03:00",
    "entry_date": "16.03.-06.04.",
    "location": "Peräseinäjoki",
    "coordinates": [
      62.5621248,
      23.0632748
    ],
    "name": "WT-Koe Peräseinäjoki",
    "organizer": "LAKEUDEN NOUTAJAKOIRAYHDISTYS RY",
    "official": {
      "name": "Marianne Aho",
      "phone": "0456741754",
      "email": "marianne.a.aho@gmail.com"
    },
    "secretary": {
      "name": "Heidi Silen",
      "phone": "",
      "email": "heidi.silen@lakeudennoutajat.fi"
    },
    "judges": [
      "Montonen Mikael",
      "Schön Esa"
    ],
    "description": "Etusija järjestävän yhdistyksen jäsenillä sekä yhdistyksen kokeissa talkoilleilla. Jäsenten osallistumismaksu 40 €, ei jäsenten 45 €. Koemaksu palautetaan koepaikan saaneille vain Kennelliiton sääntöjen määräämästä syystä. Tällaisia syitä ovat koiran sairaus, ohjaajan sairaus tai narttukoiralla alkanut kiima.",
    "cost": 45,
    "cost_member": 40,
    "classes": [
      {
        "date": "2025-04-27T00:00:00.000+03:00",
        "entries": 17,
        "judge": [],
        "state": "invited",
        "class": "ALO",
        "members": 9
      },
      {
        "date": "2025-04-27T00:00:00.000+03:00",
        "entries": 9,
        "judge": [],
        "state": "invited",
        "class": "AVO",
        "members": 3
      },
      {
        "date": "2025-04-27T00:00:00.000+03:00",
        "entries": 16,
        "judge": [],
        "state": "invited",
        "class": "VOI",
        "members": 2
      }
    ]
  },
  {
    "type": "EPÄVIRALLINEN",
    "levels": "AVO (Su), VOI (Su)",
    "date": "27.04.2025",
    "date_sort": "2025-04-27T00:00:00+03:00",
    "end_date_sort": "2025-04-27T00:00:00+03:00",
    "entry_date": "30.03.-16.04.",
    "location": "Oulunsalo",
    "coordinates": [
      64.9333388,
      25.4166674
    ],
    "name": "Hankinome",
    "organizer": "OULUN SEUDUN NOUTAJAKOIRAYHD. R.Y.",
    "official": {
      "name": "",
      "phone": "",
      "email": ""
    },
    "secretary": {
      "name": "Piia Kipinä",
      "phone": "",
      "email": "piia.k4@gmail.com"
    },
    "judges": [
      "Hatunen Jarmo",
      "Turunen Vesa",
      "Matero Teijo"
    ],
    "description": "Ilmoittautumisaikaa jatkettu 16.4. saakka. Epävirallinen dameilla suoritettava rastityyppinen koe. Koiralla ei tarvitse olla luokkaan oikeuttavia tuloksia virallisissa rodunomaisissa kokeissa. \n\nTapahtumassa järjestetään myös joukkuekilpailu: 3 koiraa/joukkue, koirat voivat olla eri luokista. Joukkuekilpailuun ilmoittaudutaan kirjaamalla lisätietoihin joukkueen nimi. Joukkuekilpailun voittaja selviää sunnuntaina palkintojen jaon yhteydessä. \nMuutokset (tuomarit, arvosteluluokat) ovat mahdollisia.\n",
    "cost": 30,
    "cost_member": 25,
    "classes": [
      {
        "date": "2025-04-26T21:00:00.000Z",
        "entries": 14,
        "judge": [
          {
            "name": "Hatunen Jarmo",
            "official": false,
            "id": -1
          },
          {
            "name": "Matero Teijo",
            "official": false,
            "id": -3
          }
        ],
        "state": "invited",
        "class": "AVO",
        "members": 0
      },
      {
        "date": "2025-04-26T21:00:00.000Z",
        "entries": 4,
        "judge": [
          {
            "name": "Turunen Vesa",
            "official": false,
            "id": -2
          }
        ],
        "state": "invited",
        "class": "VOI",
        "members": 0
      }
    ]
  },
  {
    "type": "EPÄVIRALLINEN",
    "levels": "ALO (Su), AVO (Su), VOI (Su)",
    "date": "27.04.2025",
    "date_sort": "2025-04-27T00:00:00+03:00",
    "end_date_sort": "2025-04-27T00:00:00+03:00",
    "entry_date": "16.03.-14.04.",
    "location": "Kouvola",
    "coordinates": [
      60.8680928,
      26.7038517
    ],
    "name": "Mölli-Wt",
    "organizer": "METSÄSTYSNOUTAJAT RY  JAKTRETRIEVERS RF",
    "official": {
      "name": "Nina Torri",
      "phone": "",
      "email": "ninatorri@msn.com"
    },
    "secretary": {
      "name": "Krista Leinonen",
      "phone": "",
      "email": "krista1.leinonen@gmail.com"
    },
    "judges": [
      "Jumisko Riitta",
      "Halme Timo",
      "Valkonen Esa",
      "Laakso Jenna"
    ],
    "description": "Osallistumisoikeus luokkiin niillä koirilla, joilla ei virallisissa kokeissa ole osallistumisoikeutta ylempään luokkaan. 9 kk ikä , ei taipumuskoevaatimusta.",
    "cost": 35,
    "cost_member": 25,
    "classes": [
      {
        "date": "2025-04-26T21:00:00.000Z",
        "entries": 35,
        "members": 24,
        "groups": [
          "kp"
        ],
        "judge": [
          {
            "name": "Jumisko Riitta",
            "official": false,
            "id": -1
          },
          {
            "name": "Halme Timo",
            "official": false,
            "id": -2
          },
          {
            "name": "Valkonen Esa",
            "official": false,
            "id": -3
          },
          {
            "name": "Laakso Jenna",
            "official": false,
            "id": -4
          }
        ],
        "state": "invited",
        "class": "ALO"
      },
      {
        "date": "2025-04-26T21:00:00.000Z",
        "entries": 9,
        "members": 6,
        "groups": [
          "kp"
        ],
        "judge": [
          {
            "name": "Jumisko Riitta",
            "official": false,
            "id": -1
          },
          {
            "name": "Halme Timo",
            "official": false,
            "id": -2
          },
          {
            "name": "Valkonen Esa",
            "official": false,
            "id": -3
          },
          {
            "name": "Laakso Jenna",
            "official": false,
            "id": -4
          }
        ],
        "state": "invited",
        "class": "AVO"
      },
      {
        "date": "2025-04-26T21:00:00.000Z",
        "entries": 4,
        "members": 4,
        "groups": [
          "kp"
        ],
        "judge": [
          {
            "name": "Jumisko Riitta",
            "official": false,
            "id": -1
          },
          {
            "name": "Halme Timo",
            "official": false,
            "id": -2
          },
          {
            "name": "Valkonen Esa",
            "official": false,
            "id": -3
          },
          {
            "name": "Laakso Jenna",
            "official": false,
            "id": -4
          }
        ],
        "state": "invited",
        "class": "VOI"
      }
    ]
  },
  {
    "type": "NOWT",
    "levels": "AVO (To), VOI (To)",
    "date": "01.05.2025",
    "date_sort": "2025-05-01T00:00:00+03:00",
    "end_date_sort": "2025-05-01T00:00:00+03:00",
    "entry_date": "20.03.-21.04.",
    "location": "Hamina",
    "coordinates": [
      60.5683467,
      27.1925862
    ],
    "name": "Mock Trial",
    "organizer": "KAAKON NOUTAJAKOIRAYHDISTYS RY",
    "official": {
      "name": "Mika Kuoppamäki",
      "phone": "",
      "email": ""
    },
    "secretary": {
      "name": "Pauliina Ahola",
      "phone": "0505116335",
      "email": "reedrunners@gmail.com"
    },
    "judges": [
      "Saarinen Maarit",
      "Paul Toal"
    ],
    "description": "Koe järjestetään yhteistyössä Ihamaan metsästysyhdistys ry:n kanssa.",
    "cost": 50,
    "cost_member": 45,
    "classes": [
      {
        "date": "2025-04-30T21:00:00.000Z",
        "places": 16,
        "entries": 10,
        "members": 5,
        "judge": [],
        "state": "invited",
        "class": "AVO"
      },
      {
        "date": "2025-04-30T21:00:00.000Z",
        "places": 16,
        "entries": 18,
        "members": 10,
        "judge": [],
        "state": "invited",
        "class": "VOI"
      }
    ]
  },
  {
    "type": "NOWT",
    "levels": "ALO (La), AVO (La), VOI (La)",
    "date": "03.05.2025",
    "date_sort": "2025-05-03T00:00:00+03:00",
    "end_date_sort": "2025-05-03T00:00:00+03:00",
    "entry_date": "22.03.-22.04.",
    "location": "Kemiönsaari",
    "coordinates": [
      60.1650696,
      22.7269885
    ],
    "name": "",
    "organizer": "AURAN NUUSKUT RY",
    "official": {
      "name": "Outi Pensikkala",
      "phone": "041 504 9698",
      "email": "outiannika@hotmail.fi"
    },
    "secretary": {
      "name": "Liisa Ewart",
      "phone": "0400 592 150",
      "email": "liisa.ewart@gmail.com"
    },
    "judges": [
      "Saarinen Maarit",
      "Schön Esa",
      "Särkänlahti Jari"
    ],
    "description": "HUOM! Ilmoittautumisaikaa jatkettu 22.4. asti.\n\nEtusija Auran Nuuskujen jäsenille. Jäsenyyden oltava voimassa ilmoittautumisen alkaessa. \nEtusijasäännöt ja koemaksupalautusten ehdot luettavissa yhdistyksen sivuilta https://www.aurannuuskut.org/nou-nome-wt/kokeet/etusijasaannot-ja-koemaksun-palautu/",
    "cost": 45,
    "cost_member": 40,
    "classes": [
      {
        "date": "2025-05-03T00:00:00.000+03:00",
        "entries": 20,
        "members": 12,
        "groups": [
          "kp"
        ],
        "judge": [],
        "state": "invited",
        "class": "ALO"
      },
      {
        "date": "2025-05-03T00:00:00.000+03:00",
        "entries": 12,
        "members": 8,
        "groups": [
          "kp"
        ],
        "judge": [],
        "state": "invited",
        "class": "AVO"
      },
      {
        "date": "2025-05-03T00:00:00.000+03:00",
        "entries": 15,
        "members": 11,
        "groups": [
          "kp"
        ],
        "judge": [],
        "state": "invited",
        "class": "VOI"
      }
    ]
  },
  {
    "type": "NOWT",
    "levels": "ALO (La), AVO (La), VOI (Su)",
    "date": "03.-04.05.2025",
    "date_sort": "2025-05-03T00:00:00+03:00",
    "end_date_sort": "2025-05-04T23:59:59.999000+03:00",
    "entry_date": "22.03.-23.04.",
    "location": "Orivesi",
    "coordinates": [
      61.6775495,
      24.3587506
    ],
    "name": "Metsästysnoutajat ry:n WT-mestaruuskoe",
    "organizer": "METSÄSTYSNOUTAJAT RY  JAKTRETRIEVERS RF",
    "official": {
      "name": "Janne Paananen",
      "phone": "",
      "email": "japa.paananen@gmail.com"
    },
    "secretary": {
      "name": "Maija Grönlund",
      "phone": "",
      "email": "maijagronlund@gmail.com"
    },
    "judges": [
      "Sipola Miso",
      "Vitikka Minja"
    ],
    "description": "Kilpailijoilla mahdollisuus yöpyä Einon Pirtillä. Koirien tulee olla häkissä sisätiloissa. Einon Pirtiltä keittolounas 10€/henkilö\nMajoitusvaraukset suoraan Einon Pirtiltä:\nEräpyhäntie 164, 35220 Orivesi\nJarkko Kuivanen 040 8312 532\neinonpirtti@outlook.com",
    "cost": 45,
    "cost_member": 35,
    "classes": [
      {
        "date": "2025-05-02T21:00:00.000Z",
        "places": 25,
        "entries": 19,
        "members": 13,
        "judge": [],
        "state": "invited",
        "class": "ALO"
      },
      {
        "date": "2025-05-02T21:00:00.000Z",
        "places": 20,
        "entries": 18,
        "members": 11,
        "judge": [],
        "state": "invited",
        "class": "AVO"
      },
      {
        "date": "2025-05-03T21:00:00.000Z",
        "places": 40,
        "entries": 18,
        "members": 13,
        "judge": [],
        "state": "invited",
        "class": "VOI"
      }
    ]
  },
  {
    "type": "NOWT",
    "levels": "AVO (Su), VOI (Su)",
    "date": "04.05.2025",
    "date_sort": "2025-05-04T00:00:00+03:00",
    "end_date_sort": "2025-05-04T00:00:00+03:00",
    "entry_date": "23.03.-22.04.",
    "location": "Kemiönsaari",
    "coordinates": [
      60.1650696,
      22.7269885
    ],
    "name": "Mock trial",
    "organizer": "AURAN NUUSKUT RY",
    "official": {
      "name": "Julia Gustafsson",
      "phone": "050 590 2717",
      "email": "lottajulia.gustafsson@gmail.com"
    },
    "secretary": {
      "name": "Liisa Ewart",
      "phone": "0400 592 150",
      "email": "liisa.ewart@gmail.com"
    },
    "judges": [
      "Saarinen Maarit",
      "Schön Esa"
    ],
    "description": "HUOM! Ilmoittautumisaikaa jatkettu 22.4. asti.\n\nAuran Nuuskujen jäsenet etusijalla. Jäsenyyden oltava voimassa ilmoittautumisen alkaessa. \nEtusijasäännöt ja koemaksupalautusten ehdot luettavissa yhdistyksen sivuilta https://www.aurannuuskut.org/nou-nome-wt/kokeet/etusijasaannot-ja-koemaksun-palautu/",
    "cost": 45,
    "cost_member": 40,
    "classes": [
      {
        "date": "2025-05-03T21:00:00.000Z",
        "places": 14,
        "entries": 7,
        "members": 4,
        "groups": [
          "kp"
        ],
        "judge": [],
        "state": "invited",
        "class": "AVO"
      },
      {
        "date": "2025-05-03T21:00:00.000Z",
        "places": 17,
        "entries": 14,
        "members": 10,
        "groups": [
          "kp"
        ],
        "judge": [],
        "state": "invited",
        "class": "VOI"
      }
    ]
  },
  {
    "type": "NOU",
    "levels": "N/A",
    "date": "11.05.2025",
    "date_sort": "2025-05-11T00:00:00+03:00",
    "end_date_sort": "2025-05-11T00:00:00+03:00",
    "entry_date": "21.04.-04.05.",
    "location": "Koria",
    "coordinates": [
      60.8470824,
      26.6012815
    ],
    "name": "Taipumuskoe",
    "organizer": "PÄIJÄT-HÄMEEN NOUTAJAKOIRAYHDISTYS",
    "official": {
      "name": "Virve Jäntti",
      "phone": "",
      "email": ""
    },
    "secretary": {
      "name": "Satu Orola",
      "phone": "",
      "email": "satu.orola@mm.group"
    },
    "judges": [
      "Tenhunen Juha"
    ],
    "description": "Etusija järjestävän yhdistyksen jäsenillä sekä yhdistyksen kokeissa talkoilleilla. (Koe anotaan \"etusijalla järjestäjän kutsumat koirat\". Näitä voi olla 1/3 kokeen osallistujista.) Jäsenten osallistumismaksu 45 €.\n\nKoemaksu palautetaan koepaikan saaneille (arvonnasta tai varasijalta) vain Kennelliiton sääntöjen määräämästä syystä. Tällaisia syitä ovat koiran sairaus, ohjaajan sairaus tai narttukoiralla alkanut kiima. Huom: kokeessa hakuruudussa riistana on fasaani, vesityössä sorsa",
    "cost": 55,
    "cost_member": 45,
    "classes": []
  },
  {
    "type": "NOWT",
    "levels": "ALO (La), AVO (La), VOI (La)",
    "date": "16.05.2025",
    "date_sort": "2025-05-16T21:00:00+00:00",
    "end_date_sort": "2025-05-16T21:00:00+00:00",
    "entry_date": "04.04.-05.05.",
    "location": "Laukaa",
    "coordinates": [
      62.416667,
      25.95
    ],
    "name": "",
    "organizer": "SUOMEN SILEÄKARVAISET NOUTAJAT RY",
    "official": {
      "name": "Riikka Tahvanainen",
      "phone": "",
      "email": "tahvanainen.riikka@elisanet.fi"
    },
    "secretary": {
      "name": "Tiina Saarinen",
      "phone": "",
      "email": "tiinajohanna.saarinen@gmail.com"
    },
    "judges": [
      "Saarinen Maarit",
      "Montonen Mikael",
      "Salo Mervi",
      "Torila Mika"
    ],
    "description": "ILMOITTAUTUMISAIKAA JATKETTU!\n2.5. mennessä ilmoittautuneet ovat mahtuneet kokeeseen. \n\nKoe on sileäkarvaisten noutajien mestaruuskoe. \n\nEtusija Suomen Sileäkarvaisten noutajien jäsenillä, sieläkarvaisilla noutajilla sekä edellä mainitun yhdistyksen kokeissa talkoilleilla (koe anotaan \"etusijalla järjestäjän kutsumat koirat\". Näitä voi olla 1/3 kokeen osallistujista).\n\nKoe järjestetään Varjolan tilan mailla. Päivän aikana tarjoillaan keittolounas hintaan 16€, maksu Varjolaan. Ilmoittautuminen lounaalle lomakkeella, jotta voidaan varata oikea ruokamäärä: https://ksnoutajat.nettilomake.fi/form/19892.\nMahdolliset majoitustiedustelut sekä asuntovaunu, -auto paikat suoraan Varjolaan https://www.varjola.com/yhteystiedot\n",
    "cost": 45,
    "cost_member": 40,
    "classes": [
      {
        "date": "2025-05-16T21:00:00.000Z",
        "entries": 26,
        "judge": [],
        "state": "invited",
        "class": "ALO",
        "members": 14
      },
      {
        "date": "2025-05-16T21:00:00.000Z",
        "entries": 16,
        "judge": [],
        "state": "invited",
        "class": "AVO",
        "members": 4
      },
      {
        "date": "2025-05-16T21:00:00.000Z",
        "entries": 24,
        "judge": [],
        "state": "invited",
        "class": "VOI",
        "members": 7
      }
    ]
  },
  {
    "type": "NOU",
    "levels": "N/A",
    "date": "16.05.2025",
    "date_sort": "2025-05-16T21:00:00+00:00",
    "end_date_sort": "2025-05-16T21:00:00+00:00",
    "entry_date": "04.04.-01.05.",
    "location": "Tampere",
    "coordinates": [
      61.4977929,
      23.7616372
    ],
    "name": "",
    "organizer": "PIRKANMAAN NOUTAJAKOIRAYHDISTYS RY",
    "official": {
      "name": "Maarit Martikainen",
      "phone": "",
      "email": ""
    },
    "secretary": {
      "name": "Maarit Martikainen",
      "phone": "",
      "email": "cockeri90@gmail.com"
    },
    "judges": [
      "Vimpeli Jouni"
    ],
    "description": "Koiran tai omistajan sairastuessa osallistumismaksu palautetaan lääkärintodistusta vastaan. Narttukoiran juoksun alkaessa koemaksu palautetaan. Ilmoittautumalla hyväksyn, että kokeen järjestämisen vastuuhenkilöt voivat käsitellä ilmoittamiani henkilötietoja ja julkaista niitä tarpeen mukaisesti ja soveltuvin osin kokeen osallistuja- ja tulosluettelossa koepaikalla ja kokeeseen liittyvissä julkaisuissa internetissä tai muissa yhdistyksen medioissa. Lisätietoja Pirkanmaan Noutajakoirayhdistyksen tietosuojasta osoitteessa: www.pirkannuusku.net/yhdistys2/tietosuojaseloste/",
    "cost": 50,
    "cost_member": 45,
    "classes": []
  },
  {
    "type": "NOWT",
    "levels": "ALO (La), AVO (La), VOI (La)",
    "date": "16.05.2025",
    "date_sort": "2025-05-16T21:00:00+00:00",
    "end_date_sort": "2025-05-16T21:00:00+00:00",
    "entry_date": "04.04.-24.04.",
    "location": "Raasepori",
    "coordinates": [
      59.9285263,
      23.5219234
    ],
    "name": "",
    "organizer": "UUDENMAAN NOUTAJAKOIRAYHDISTYS",
    "official": {
      "name": "Bernadetta Stenström",
      "phone": "",
      "email": "bernadetta.stenstrom@gmail.com"
    },
    "secretary": {
      "name": "Arja Helenius",
      "phone": "",
      "email": "nome.umn@umn.fi"
    },
    "judges": [
      "Sipola Miso",
      "Lähteenaro Janne"
    ],
    "description": "",
    "cost": 45,
    "cost_member": 40,
    "classes": [
      {
        "date": "2025-05-16T21:00:00.000Z",
        "entries": 16,
        "judge": [],
        "state": "invited",
        "class": "ALO",
        "members": 15
      },
      {
        "date": "2025-05-16T21:00:00.000Z",
        "entries": 6,
        "judge": [],
        "state": "invited",
        "class": "AVO",
        "members": 1
      },
      {
        "date": "2025-05-16T21:00:00.000Z",
        "entries": 9,
        "judge": [],
        "state": "invited",
        "class": "VOI",
        "members": 5
      }
    ]
  },
  {
    "type": "NOU",
    "levels": "N/A",
    "date": "17.05.2025",
    "date_sort": "2025-05-17T00:00:00+03:00",
    "end_date_sort": "2025-05-17T00:00:00+03:00",
    "entry_date": "05.04.-26.04.",
    "location": "Kouvola",
    "coordinates": [
      60.8680928,
      26.7038517
    ],
    "name": "Noutajien taipumuskoe",
    "organizer": "KAAKON NOUTAJAKOIRAYHDISTYS RY",
    "official": {
      "name": "Pia Riiheläinen",
      "phone": "",
      "email": "pia.riihelainen@gmail.com"
    },
    "secretary": {
      "name": "Terhi Yrjölä",
      "phone": "",
      "email": "terhi.yrjola@gmail.com"
    },
    "judges": [
      "Silvennoinen Kari"
    ],
    "description": "",
    "cost": 50,
    "cost_member": 35,
    "classes": []
  },
  {
    "type": "NOU",
    "levels": "N/A",
    "date": "17.05.2025",
    "date_sort": "2025-05-17T00:00:00+03:00",
    "end_date_sort": "2025-05-17T00:00:00+03:00",
    "entry_date": "05.04.-26.04.",
    "location": "Pöytyä",
    "coordinates": [
      60.7409756,
      22.6282676
    ],
    "name": "",
    "organizer": "AURAN NUUSKUT RY",
    "official": {
      "name": "Julia Gustafsson",
      "phone": "0505902717",
      "email": "lottajulia.gustafsson@gmail.com"
    },
    "secretary": {
      "name": "Julia Gustafsson",
      "phone": "0505902717",
      "email": "lottajulia.gustafsson@gmail.com"
    },
    "judges": [
      "Aaltonen Risto"
    ],
    "description": "Etusija Auran Nuuskujen jäsenille. Jäsenyyden oltava voimassa ilmoittautumisen alkaessa. \nEtusijasäännöt ja koemaksupalautusten ehdot luettavissa yhdistyksen sivuilta https://www.aurannuuskut.org/nou-nome-wt/kokeet/etusijasaannot-ja-koemaksun-palautu/",
    "cost": 45,
    "cost_member": 40,
    "classes": []
  },
  {
    "type": "NOWT",
    "levels": "ALO (Su), AVO (Su), VOI (Su)",
    "date": "17.05.2025",
    "date_sort": "2025-05-17T21:00:00+00:00",
    "end_date_sort": "2025-05-17T21:00:00+00:00",
    "entry_date": "05.04.-05.05.",
    "location": "Laukaa",
    "coordinates": [
      62.416667,
      25.95
    ],
    "name": "",
    "organizer": "KESKI-SUOMEN NOUTAJAKOIRAYHDISTYS RY.",
    "official": {
      "name": "Niina Parviainen",
      "phone": "",
      "email": "parviainen_niina@outlook.com"
    },
    "secretary": {
      "name": "Tiina Saarinen",
      "phone": "",
      "email": "tiinajohanna.saarinen@gmail.com"
    },
    "judges": [
      "Salo Mervi",
      "Saarinen Maarit",
      "Montonen Mikael",
      "Torila Mika"
    ],
    "description": "ILMOITTAUTUMISAIKAA JATKETTU!\n2.5. mennessä ilmoittautuneet ovat mahtuneet kokeeseen. \n\nKoe järjestetään Varjolan tilan mailla. Päivän aikana tarjoillaan keittolounas hintaan 16€, maksu Varjolaan. Ilmoittautuminen lounaalle lomakkeella, jotta voidaan varata oikea ruokamäärä: https://ksnoutajat.nettilomake.fi/form/19892.\nMahdolliset majoitustiedustelut sekä asuntovaunu, -auto paikat suoraan Varjolaan https://www.varjola.com/yhteystiedot",
    "cost": 45,
    "cost_member": 40,
    "classes": [
      {
        "date": "2025-05-17T21:00:00.000Z",
        "entries": 15,
        "judge": [],
        "state": "invited",
        "class": "ALO",
        "members": 6
      },
      {
        "date": "2025-05-17T21:00:00.000Z",
        "entries": 24,
        "judge": [],
        "state": "invited",
        "class": "AVO",
        "members": 10
      },
      {
        "date": "2025-05-17T21:00:00.000Z",
        "entries": 22,
        "judge": [],
        "state": "invited",
        "class": "VOI",
        "members": 9
      }
    ]
  },
  {
    "type": "NOME-B",
    "levels": "ALO (La)",
    "date": "23.05.2025",
    "date_sort": "2025-05-23T21:00:00+00:00",
    "end_date_sort": "2025-05-23T21:00:00+00:00",
    "entry_date": "27.04.-16.05.",
    "location": "Salo",
    "coordinates": [
      60.3879158,
      23.1248694
    ],
    "name": "",
    "organizer": "SALON SEUDUN NOUTAJAT R.Y.",
    "official": {
      "name": "Mikko Ahti",
      "phone": "050 484 3106",
      "email": ""
    },
    "secretary": {
      "name": "Saila Jalonen",
      "phone": "044 538 5225",
      "email": "saila.jalonen@evidensia.fi"
    },
    "judges": [
      "Salonen Susanna"
    ],
    "description": "https://www.salonseudunnoutajat.fi/nou-nome/nou-nome-kokeet/",
    "cost": 48,
    "cost_member": 42,
    "classes": [
      {
        "date": "2025-05-23T21:00:00.000Z",
        "places": 15,
        "entries": 22,
        "members": 14,
        "judge": [
          {
            "name": "Salonen Susanna",
            "official": true,
            "id": 835312
          }
        ],
        "state": "invited",
        "class": "ALO"
      }
    ]
  },
  {
    "type": "NOU",
    "levels": "N/A",
    "date": "23.05.2025",
    "date_sort": "2025-05-23T21:00:00+00:00",
    "end_date_sort": "2025-05-23T21:00:00+00:00",
    "entry_date": "27.04.-16.05.",
    "location": "Salo",
    "coordinates": [
      60.3879158,
      23.1248694
    ],
    "name": "",
    "organizer": "SALON SEUDUN NOUTAJAT R.Y.",
    "official": {
      "name": "Veera Lempiäinen",
      "phone": "0407419053",
      "email": ""
    },
    "secretary": {
      "name": "Virpi Eroma",
      "phone": "0407783243",
      "email": "virpi@virpieroma.fi"
    },
    "judges": [
      "Salonen Tommy"
    ],
    "description": "https://www.salonseudunnoutajat.fi/nou-nome/nou-nome-kokeet/",
    "cost": 48,
    "cost_member": 42,
    "classes": []
  },
  {
    "type": "NOU",
    "levels": "N/A",
    "date": "23.05.2025",
    "date_sort": "2025-05-23T21:00:00+00:00",
    "end_date_sort": "2025-05-23T21:00:00+00:00",
    "entry_date": "11.04.-02.05.",
    "location": "Raasepori",
    "coordinates": [
      59.9285263,
      23.5219234
    ],
    "name": "",
    "organizer": "UUDENMAAN NOUTAJAKOIRAYHDISTYS",
    "official": {
      "name": "Bernadetta Stenström",
      "phone": "",
      "email": ""
    },
    "secretary": {
      "name": "Bernadetta Stenström",
      "phone": "",
      "email": "nome.umn@umn.fi"
    },
    "judges": [
      "Tuominen Petri"
    ],
    "description": "",
    "cost": 45,
    "cost_member": 40,
    "classes": []
  },
  {
    "type": "NOME-B",
    "levels": "ALO (La)",
    "date": "23.05.2025",
    "date_sort": "2025-05-23T21:00:00+00:00",
    "end_date_sort": "2025-05-23T21:00:00+00:00",
    "entry_date": "11.04.-08.05.",
    "location": "Tampere",
    "coordinates": [
      61.4977929,
      23.7616372
    ],
    "name": "",
    "organizer": "PIRKANMAAN NOUTAJAKOIRAYHDISTYS RY",
    "official": {
      "name": "Elina Kestilä-Kekkonen",
      "phone": "",
      "email": ""
    },
    "secretary": {
      "name": "Satu Rivinoja",
      "phone": "",
      "email": "rivinojas@gmail.com"
    },
    "judges": [
      "Tenhunen Juha"
    ],
    "description": "Koiran tai omistajan sairastuessa osallistumismaksu palautetaan lääkärintodistusta vastaan. Narttukoiran juoksun alkaessa koemaksu palautetaan. Ilmoittautumalla hyväksyn, että kokeen järjestämisen vastuuhenkilöt voivat käsitellä ilmoittamiani henkilötietoja ja julkaista niitä tarpeen mukaisesti ja soveltuvin osin kokeen osallistuja- ja tulosluettelossa koepaikalla ja kokeeseen liittyvissä julkaisuissa internetissä tai muissa yhdistyksen medioissa. Lisätietoja Pirkanmaan Noutajakoirayhdistyksen tietosuojasta osoitteessa: www.pirkannuusku.net/yhdistys2/tietosuojaseloste/",
    "cost": 50,
    "cost_member": 45,
    "classes": [
      {
        "date": "2025-05-23T21:00:00.000Z",
        "places": 15,
        "entries": 21,
        "members": 18,
        "judge": [
          {
            "name": "Tenhunen Juha",
            "official": true,
            "id": 999999
          }
        ],
        "state": "invited",
        "class": "ALO"
      }
    ]
  },
  {
    "type": "NOME-B",
    "levels": "ALO (La, Su), AVO (La), VOI (Su)",
    "date": "23.-24.05.2025",
    "date_sort": "2025-05-23T21:00:00+00:00",
    "end_date_sort": "2025-05-24T21:00:00+00:00",
    "entry_date": "11.04.-02.05.",
    "location": "Ähtäri",
    "coordinates": [
      62.5499772,
      24.0702272
    ],
    "name": "Nome-B koe Ähtärissä",
    "organizer": "LAKEUDEN NOUTAJAKOIRAYHDISTYS RY",
    "official": {
      "name": "Esa Aro",
      "phone": "0401907185",
      "email": "esaro0975@gmail.com"
    },
    "secretary": {
      "name": "Teresa Kari",
      "phone": "0405758523",
      "email": "toivonpolun@gmail.com"
    },
    "judges": [
      "Toskala Mika",
      "Hartikainen Jari"
    ],
    "description": "Piirinmestaruuskoe voittajaluokassa. Voittajaluokkaan etusija piirinmestaruuteen osallistuvilla.\n\nALO ja AVO : Etusija järjestävän yhdistyksen jäsenillä sekä yhdistyksen kokeissa talkoilleilla. \n\nJäsenten osallistumismaksu 40 €, ei jäsenten 45 €. Koemaksu palautetaan koepaikan saaneille vain Kennelliiton sääntöjen määräämästä syystä. Tällaisia syitä ovat koiran sairaus, ohjaajan sairaus tai narttukoiralla alkanut kiima.",
    "cost": 45,
    "cost_member": 40,
    "classes": [
      {
        "date": "2025-05-23T21:00:00.000Z",
        "places": 15,
        "entries": 26,
        "members": 10,
        "judge": [
          {
            "name": "",
            "official": true,
            "id": 0
          },
          {
            "name": "Hartikainen Jari",
            "official": true,
            "id": 696622
          }
        ],
        "state": "invited",
        "class": "ALO"
      },
      {
        "date": "2025-05-23T21:00:00.000Z",
        "places": 15,
        "entries": 9,
        "members": 4,
        "judge": [
          {
            "name": "Toskala Mika",
            "official": true,
            "id": 697689
          }
        ],
        "state": "invited",
        "class": "AVO"
      },
      {
        "date": "2025-05-24T21:00:00.000Z",
        "places": 15,
        "entries": 26,
        "members": 10,
        "judge": [
          {
            "name": "",
            "official": true,
            "id": 0
          },
          {
            "name": "Hartikainen Jari",
            "official": true,
            "id": 696622
          }
        ],
        "state": "invited",
        "class": "ALO"
      },
      {
        "date": "2025-05-24T21:00:00.000Z",
        "places": 12,
        "entries": 16,
        "members": 8,
        "judge": [
          {
            "name": "Toskala Mika",
            "official": true,
            "id": 697689
          }
        ],
        "state": "invited",
        "class": "VOI"
      }
    ]
  },
  {
    "type": "NOWT",
    "levels": "ALO (La), AVO (La), VOI (La)",
    "date": "23.05.2025",
    "date_sort": "2025-05-23T21:00:00+00:00",
    "end_date_sort": "2025-05-23T21:00:00+00:00",
    "entry_date": "11.04.-02.05.",
    "location": "Kiiminki",
    "coordinates": [
      65.1539786,
      25.8112896
    ],
    "name": "Pohjois-Pohjanmaan kennelpiirin WT- piirinmestaruus",
    "organizer": "OULUN SEUDUN NOUTAJAKOIRAYHD. R.Y.",
    "official": {
      "name": "",
      "phone": "",
      "email": ""
    },
    "secretary": {
      "name": "Oona Mönttinen",
      "phone": "",
      "email": "onska_95@hotmail.com"
    },
    "judges": [
      "Lähteenaro Janne",
      "Sipola Miso"
    ],
    "description": "Voittajaluokan koe on Pohjois-Pohjanmaan kennelpiirin mestaruuskoe, johon on etusija Pohjois-Pohjanmaan kennelpiirin alueella asuvilla ja järjestävän yhdistyksen jäsenillä.\n\nMaksunpalautuksista pidätetään 5 € käsittelykulu, jos ohjaaja peruu ilmoittautumisen. Mikäli yhdistys peruu ilmoittautumisen (ei mahdu kokeeseen), osallistumismaksu palautetaan täysimääräisenä.\n\nOsallistumismaksu 42 € jäsenet, 47 € ei jäsenet. ",
    "cost": 47,
    "cost_member": 42,
    "classes": [
      {
        "date": "2025-05-23T21:00:00.000Z",
        "entries": 15,
        "judge": [],
        "state": "invited",
        "class": "ALO",
        "members": 13
      },
      {
        "date": "2025-05-23T21:00:00.000Z",
        "entries": 13,
        "judge": [],
        "state": "invited",
        "class": "AVO",
        "members": 10
      },
      {
        "date": "2025-05-23T21:00:00.000Z",
        "entries": 14,
        "judge": [],
        "state": "invited",
        "class": "VOI",
        "members": 9
      }
    ]
  },
  {
    "type": "NOWT",
    "levels": "ALO (La), AVO (La), VOI (La)",
    "date": "24.05.2025",
    "date_sort": "2025-05-24T00:00:00+03:00",
    "end_date_sort": "2025-05-24T00:00:00+03:00",
    "entry_date": "14.04.-12.05.",
    "location": "Outokumpu",
    "coordinates": [
      62.7255326,
      29.0186972
    ],
    "name": "",
    "organizer": "POHJOIS-KARJALAN NOUTAJAKOIRAYHDIST",
    "official": {
      "name": "Heikki Nevalainen",
      "phone": "",
      "email": ""
    },
    "secretary": {
      "name": "Helinä Kettunen",
      "phone": "",
      "email": "rais_u86@hotmail.com"
    },
    "judges": [
      "Lappalainen Mika",
      "Tenhunen Matti"
    ],
    "description": "Etusija järjestävän yhdistyksen jäsenillä sekä yhdistyksen kokeissa talkoilleilla. (\"etusijalla järjestäjän kutsumat koirat\". Näitä voi olla 1/3 kokeen osallistujista.) Jäsenten osallistumismaksu 40 €, ei jäsenten 45 €. Koemaksu palautetaan koepaikan saaneille vain Kennelliiton sääntöjen määräämästä syystä. Tällaisia syitä ovat koiran sairaus, ohjaajan sairaus tai narttukoiralla alkanut kiima. Ohjaajan/omistajan peruessa ilmoittautumisen, pidätetään maksunpalautuksesta 4 € käsittelykulu. ",
    "cost": 45,
    "cost_member": 40,
    "classes": [
      {
        "date": "2025-05-24T00:00:00.000+03:00",
        "entries": 14,
        "judge": [],
        "state": "invited",
        "class": "ALO",
        "members": 10
      },
      {
        "date": "2025-05-24T00:00:00.000+03:00",
        "entries": 10,
        "judge": [],
        "state": "invited",
        "class": "AVO",
        "members": 7
      },
      {
        "date": "2025-05-24T00:00:00.000+03:00",
        "entries": 6,
        "judge": [],
        "state": "invited",
        "class": "VOI",
        "members": 2
      }
    ]
  },
  {
    "type": "NOWT",
    "levels": "VOI (La)",
    "date": "24.05.2025",
    "date_sort": "2025-05-24T00:00:00+03:00",
    "end_date_sort": "2025-05-24T00:00:00+03:00",
    "entry_date": "12.04.-10.05.",
    "location": "Hamina",
    "coordinates": [
      60.5683467,
      27.1925862
    ],
    "name": "Kymenläänin Kennelpiiri ry.n NOWT piirinmestaruus",
    "organizer": "KAAKON NOUTAJAKOIRAYHDISTYS RY",
    "official": {
      "name": "Mika Kuoppamäki",
      "phone": "",
      "email": "mkuoppamaki@gmail.com"
    },
    "secretary": {
      "name": "Riina Laiho",
      "phone": "",
      "email": "riina.laiho@hotmail.com"
    },
    "judges": [
      "Torila Mika",
      "Tuomi Pekka",
      "Uusimäki Pekka"
    ],
    "description": "Kymenläänin Kennelpiiri ry NOWT piirinmestaruus. Etusijalla Kymenläänin kennelpiirin alueella asuvat koirakot. Kaakon Noutajakoirayhdistyksen jäsenyys ei vaikuta etusijaan, eikä edullisempaan koemaksuun. \nHuom! Kaakon WT kokeen ALO, AVO ja VOI luokat alkavat samaan aikaan",
    "cost": 45,
    "cost_member": "",
    "classes": [
      {
        "date": "2025-05-24T00:00:00.000+03:00",
        "entries": 19,
        "judge": [],
        "state": "invited",
        "class": "VOI",
        "members": 0
      }
    ]
  },
  {
    "type": "NOWT",
    "levels": "ALO (La), AVO (La)",
    "date": "24.05.2025",
    "date_sort": "2025-05-24T00:00:00+03:00",
    "end_date_sort": "2025-05-24T00:00:00+03:00",
    "entry_date": "12.04.-10.05.",
    "location": "Hamina",
    "coordinates": [
      60.5683467,
      27.1925862
    ],
    "name": "",
    "organizer": "KAAKON NOUTAJAKOIRAYHDISTYS RY",
    "official": {
      "name": "Mika Kuoppamäki",
      "phone": "",
      "email": "mkuoppamaki@gmail.com"
    },
    "secretary": {
      "name": "Riina Laiho",
      "phone": "",
      "email": "riina.laiho@hotmail.com"
    },
    "judges": [
      "Torila Mika",
      "Tuomi Pekka",
      "Uusimäki Pekka"
    ],
    "description": "Huom! Kaakon WT kokeen ALO, AVO ja VOI luokat alkavat samaan aikaan",
    "cost": 45,
    "cost_member": 35,
    "classes": [
      {
        "date": "2025-05-23T21:00:00.000Z",
        "places": 0,
        "entries": 14,
        "members": 10,
        "judge": [],
        "state": "invited",
        "class": "ALO"
      },
      {
        "date": "2025-05-23T21:00:00.000Z",
        "places": 0,
        "entries": 11,
        "members": 4,
        "judge": [],
        "state": "invited",
        "class": "AVO"
      }
    ]
  },
  {
    "type": "NOU",
    "levels": "N/A",
    "date": "24.05.2025",
    "date_sort": "2025-05-24T00:00:00+03:00",
    "end_date_sort": "2025-05-24T00:00:00+03:00",
    "entry_date": "12.04.-03.05.",
    "location": "Mikkeli",
    "coordinates": [
      61.6877823,
      27.2731918
    ],
    "name": "Taipparit Haukivuori",
    "organizer": "ETELÄ-SAVON NOUTAJAKOIRAYHDISTYS RY",
    "official": {
      "name": "Arja Peltonen",
      "phone": "",
      "email": ""
    },
    "secretary": {
      "name": "Merja Tolari",
      "phone": "",
      "email": "merjatolari@gmail.com"
    },
    "judges": [
      "Puttonen Pasi"
    ],
    "description": "Jäsenyys tulee olla voimassa ilmoittautumishetkellä, jos maksaa jäsenille tarkoitetun hinnan.",
    "cost": 45,
    "cost_member": 35,
    "classes": []
  },
  {
    "type": "NOME-B",
    "levels": "AVO (Su)",
    "date": "24.05.2025",
    "date_sort": "2025-05-24T21:00:00+00:00",
    "end_date_sort": "2025-05-24T21:00:00+00:00",
    "entry_date": "12.04.-09.05.",
    "location": "Tampere",
    "coordinates": [
      61.4977929,
      23.7616372
    ],
    "name": "",
    "organizer": "PIRKANMAAN NOUTAJAKOIRAYHDISTYS RY",
    "official": {
      "name": "Elina Kestilä-Kekkonen",
      "phone": "",
      "email": ""
    },
    "secretary": {
      "name": "Satu Rivinoja",
      "phone": "",
      "email": "rivinojas@gmail.com"
    },
    "judges": [
      "Tenhunen Juha"
    ],
    "description": "Koiran tai omistajan sairastuessa osallistumismaksu palautetaan lääkärintodistusta vastaan. Narttukoiran juoksun alkaessa koemaksu palautetaan. Ilmoittautumalla hyväksyn, että kokeen järjestämisen vastuuhenkilöt voivat käsitellä ilmoittamiani henkilötietoja ja julkaista niitä tarpeen mukaisesti ja soveltuvin osin kokeen osallistuja- ja tulosluettelossa koepaikalla ja kokeeseen liittyvissä julkaisuissa internetissä tai muissa yhdistyksen medioissa. Lisätietoja Pirkanmaan Noutajakoirayhdistyksen tietosuojasta osoitteessa: www.pirkannuusku.net/yhdistys2/tietosuojaseloste/",
    "cost": 50,
    "cost_member": 45,
    "classes": [
      {
        "date": "2025-05-24T21:00:00.000Z",
        "places": 15,
        "entries": 14,
        "members": 6,
        "judge": [
          {
            "name": "Tenhunen Juha",
            "official": true,
            "id": 999999
          }
        ],
        "state": "invited",
        "class": "AVO"
      }
    ]
  },
  {
    "type": "NOWT",
    "levels": "ALO (Su), AVO (Su), VOI (Su)",
    "date": "24.05.2025",
    "date_sort": "2025-05-24T21:00:00+00:00",
    "end_date_sort": "2025-05-24T21:00:00+00:00",
    "entry_date": "12.04.-03.05.",
    "location": "Kiiminki",
    "coordinates": [
      65.1539786,
      25.8112896
    ],
    "name": "Kultaistennoutajien WT-mestaruus",
    "organizer": "OULUN SEUDUN NOUTAJAKOIRAYHD. R.Y.",
    "official": {
      "name": "",
      "phone": "",
      "email": ""
    },
    "secretary": {
      "name": "Oona Mönttinen",
      "phone": "",
      "email": "onska_95@hotmail.com"
    },
    "judges": [
      "Lähteenaro Janne",
      "Sipola Miso"
    ],
    "description": "Koe on kultaistennoutajien WT- mestaruus\n\nMaksunpalautuksista pidätetään 5 € käsittelykulu, jos ohjaaja peruu ilmoittautumisen. Mikäli yhdistys peruu ilmoittautumisen (ei mahdu kokeeseen), osallistumismaksu palautetaan täysimääräisenä.\n\nOsallistumismaksu 42 € jäsenet, 47 € ei jäsenet. ",
    "cost": 47,
    "cost_member": 42,
    "classes": [
      {
        "date": "2025-05-24T21:00:00.000Z",
        "entries": 11,
        "judge": [],
        "state": "invited",
        "class": "ALO",
        "members": 9
      },
      {
        "date": "2025-05-24T21:00:00.000Z",
        "entries": 13,
        "judge": [],
        "state": "invited",
        "class": "AVO",
        "members": 12
      },
      {
        "date": "2025-05-24T21:00:00.000Z",
        "entries": 12,
        "judge": [],
        "state": "invited",
        "class": "VOI",
        "members": 11
      }
    ]
  },
  {
    "type": "NOME-B",
    "levels": "ALO (Su)",
    "date": "24.05.2025",
    "date_sort": "2025-05-24T21:00:00+00:00",
    "end_date_sort": "2025-05-24T21:00:00+00:00",
    "entry_date": "12.04.-03.05.",
    "location": "Raasepori",
    "coordinates": [
      59.9285263,
      23.5219234
    ],
    "name": "",
    "organizer": "UUDENMAAN NOUTAJAKOIRAYHDISTYS",
    "official": {
      "name": "Janne Rönni",
      "phone": "",
      "email": ""
    },
    "secretary": {
      "name": "Janne Rönni",
      "phone": "",
      "email": "janne.ronni@umn.fi"
    },
    "judges": [
      "Tuominen Petri"
    ],
    "description": "",
    "cost": 45,
    "cost_member": 40,
    "classes": [
      {
        "date": "2025-05-24T21:00:00.000Z",
        "places": 15,
        "entries": 16,
        "members": 13,
        "judge": [
          {
            "name": "Tuominen Petri",
            "official": true,
            "id": 875766
          }
        ],
        "state": "invited",
        "class": "ALO"
      }
    ]
  },
  {
    "type": "EPÄVIRALLINEN",
    "levels": "N/A",
    "date": "25.05.2025",
    "date_sort": "2025-05-25T00:00:00+03:00",
    "end_date_sort": "2025-05-25T00:00:00+03:00",
    "entry_date": "24.04.-16.05.",
    "location": "Varpanen, Suonenjoki",
    "coordinates": [
      62.6210349,
      27.2292733
    ],
    "name": "Möllitaipumuskoe",
    "organizer": "SAVON NUUSKUT RY",
    "official": {
      "name": "Tero Rönkkö",
      "phone": "044-2220019",
      "email": "tero@savonnuuskut.com"
    },
    "secretary": {
      "name": "Tero Rönkkö",
      "phone": "044-2220019",
      "email": "tero@savonnuuskut.com"
    },
    "judges": [
      "Ilpo Pöyhönen"
    ],
    "description": "Möllitaipumuskoe\n\nEtusija taipumuskoekurssille osallistuneilla, yhdistyksen jäsenillä sekä yhdistyksen kokeissa talkoilevilla.",
    "cost": 50,
    "cost_member": 45,
    "classes": []
  },
  {
    "type": "NOWT",
    "levels": "ALO (Su), AVO (Su), VOI (Su)",
    "date": "25.05.2025",
    "date_sort": "2025-05-25T00:00:00+03:00",
    "end_date_sort": "2025-05-25T00:00:00+03:00",
    "entry_date": "14.04.-12.05.",
    "location": "Outokumpu",
    "coordinates": [
      62.7255326,
      29.0186972
    ],
    "name": "",
    "organizer": "POHJOIS-KARJALAN NOUTAJAKOIRAYHDIST",
    "official": {
      "name": "Heikki Nevalainen",
      "phone": "",
      "email": ""
    },
    "secretary": {
      "name": "Helinä Kettunen",
      "phone": "",
      "email": "rais_u86@hotmail.com"
    },
    "judges": [
      "Lappalainen Mika",
      "Tenhunen Matti"
    ],
    "description": "Etusija järjestävän yhdistyksen jäsenillä sekä yhdistyksen kokeissa talkoilleilla. (\"etusijalla järjestäjän kutsumat koirat\". Näitä voi olla 1/3 kokeen osallistujista.) Jäsenten osallistumismaksu 40 €, ei jäsenten 45 €. Koemaksu palautetaan koepaikan saaneille vain Kennelliiton sääntöjen määräämästä syystä. Tällaisia syitä ovat koiran sairaus, ohjaajan sairaus tai narttukoiralla alkanut kiima. Ohjaajan/omistajan peruessa ilmoittautumisen, pidätetään maksunpalautuksesta 4 € käsittelykulu. ",
    "cost": 45,
    "cost_member": 40,
    "classes": [
      {
        "date": "2025-05-25T00:00:00.000+03:00",
        "entries": 11,
        "judge": [],
        "state": "invited",
        "class": "ALO",
        "members": 7
      },
      {
        "date": "2025-05-25T00:00:00.000+03:00",
        "entries": 8,
        "judge": [],
        "state": "invited",
        "class": "AVO",
        "members": 5
      },
      {
        "date": "2025-05-25T00:00:00.000+03:00",
        "entries": 7,
        "judge": [],
        "state": "invited",
        "class": "VOI",
        "members": 1
      }
    ]
  },
  {
    "type": "NOU",
    "levels": "N/A",
    "date": "28.05.2025",
    "date_sort": "2025-05-28T21:00:00+00:00",
    "end_date_sort": "2025-05-28T21:00:00+00:00",
    "entry_date": "16.04.-07.05.",
    "location": "Peräseinäjoki",
    "coordinates": [
      62.5621248,
      23.0632748
    ],
    "name": "Taipumuskoe Peräseinäjoella",
    "organizer": "LAKEUDEN NOUTAJAKOIRAYHDISTYS RY",
    "official": {
      "name": "Virpi Kuutti",
      "phone": "0401676747",
      "email": "virpi.kuutti@lakeudennoutajat.fi"
    },
    "secretary": {
      "name": "Maria Pasto",
      "phone": "",
      "email": "maria.pasto@lakeudennoutajat.fi"
    },
    "judges": [
      "Koskiahde Timo"
    ],
    "description": "Etusija järjestävän yhdistyksen jäsenillä sekä yhdistyksen kokeissa talkoilleilla. \nJäsenten osallistumismaksu 40 €, ei jäsenten 45 €. Koemaksu palautetaan koepaikan saaneille vain Kennelliiton sääntöjen määräämästä syystä. Tällaisia syitä ovat koiran sairaus, ohjaajan sairaus tai narttukoiralla alkanut kiima.",
    "cost": 45,
    "cost_member": 40,
    "classes": []
  },
  {
    "type": "NOU",
    "levels": "N/A",
    "date": "29.05.2025",
    "date_sort": "2025-05-29T00:00:00+03:00",
    "end_date_sort": "2025-05-29T00:00:00+03:00",
    "entry_date": "17.04.-08.05.",
    "location": "Kouvola",
    "coordinates": [
      60.8680928,
      26.7038517
    ],
    "name": "",
    "organizer": "LABRADORINNOUTAJAKERHO R.Y.",
    "official": {
      "name": "",
      "phone": "",
      "email": ""
    },
    "secretary": {
      "name": "Ulla Alhava",
      "phone": "",
      "email": "ulla.alhava@gmail.com"
    },
    "judges": [
      "Puttonen Pasi"
    ],
    "description": "",
    "cost": 45,
    "cost_member": 40,
    "classes": []
  },
  {
    "type": "NOU",
    "levels": "N/A",
    "date": "29.05.2025",
    "date_sort": "2025-05-29T00:00:00+03:00",
    "end_date_sort": "2025-05-29T00:00:00+03:00",
    "entry_date": "17.04.-08.05.",
    "location": "Sastamala",
    "coordinates": [
      61.450048,
      22.8416609
    ],
    "name": "",
    "organizer": "METSÄSTYSNOUTAJAT RY  JAKTRETRIEVERS RF",
    "official": {
      "name": "Annukka Näsinlinna",
      "phone": "",
      "email": "annukkae.m@gmail.com"
    },
    "secretary": {
      "name": "Sirpa Lastunen-Turppa",
      "phone": "",
      "email": "sirpa.lastunen-turppa@kopteri.net"
    },
    "judges": [
      "Salonen Tommy"
    ],
    "description": "",
    "cost": 45,
    "cost_member": 35,
    "classes": []
  },
  {
    "type": "EPÄVIRALLINEN",
    "levels": "ALO (To), AVO (To), VOI (To)",
    "date": "29.05.2025",
    "date_sort": "2025-05-29T00:00:00+03:00",
    "end_date_sort": "2025-05-29T00:00:00+03:00",
    "entry_date": "17.04.-08.05.",
    "location": "Kangasniemi",
    "coordinates": [
      61.9895047,
      26.6440817
    ],
    "name": "Mölli WT",
    "organizer": "SAVON NUUSKUT RY",
    "official": {
      "name": "",
      "phone": "",
      "email": ""
    },
    "secretary": {
      "name": "",
      "phone": "",
      "email": ""
    },
    "judges": [
      "Siitari Heli",
      "Luomanen Timo"
    ],
    "description": "ILMOITTAUTUMISET SÄHKÖPOSTITSE:\n\nNadja Hakkarainen\nnadja9115@gmail.com\n\n\nKerro ilmoittautuessasi:\n• Mihin luokkaan osallistut.\n• Koirasi kutsumanimi.\n• Oletko Savon Nuuskujen jäsen?\n• Osallistutko lounaalle?",
    "cost": 45,
    "cost_member": 40,
    "classes": [
      {
        "date": "2025-05-29T00:00:00.000+03:00",
        "class": "ALO",
        "judge": []
      },
      {
        "date": "2025-05-29T00:00:00.000+03:00",
        "class": "AVO",
        "judge": []
      },
      {
        "date": "2025-05-29T00:00:00.000+03:00",
        "class": "VOI",
        "judge": []
      }
    ]
  },
  {
    "type": "NOU",
    "levels": "N/A",
    "date": "30.-31.05.2025",
    "date_sort": "2025-05-30T21:00:00+00:00",
    "end_date_sort": "2025-05-31T21:00:00+00:00",
    "entry_date": "23.04.-10.05.",
    "location": "Kuopio",
    "coordinates": [
      62.8924641,
      27.6783597
    ],
    "name": "Noutajien taipumuskoe",
    "organizer": "SAVON NUUSKUT RY",
    "official": {
      "name": "Minna-Reetta Innilä",
      "phone": "044-7197565",
      "email": "reetta.tiilikainen@gmail.com"
    },
    "secretary": {
      "name": "Jonna Mykkänen",
      "phone": "0442973607",
      "email": "mykkanenjonna84@gmail.com"
    },
    "judges": [
      "Varis Taija"
    ],
    "description": "Etusija järjestävän yhdistyksen jäsenillä sekä yhdistyksen kokeissa talkoilevilla.",
    "cost": 50,
    "cost_member": 45,
    "classes": []
  },
  {
    "type": "NOU",
    "levels": "N/A",
    "date": "05.06.2025",
    "date_sort": "2025-06-05T00:00:00+03:00",
    "end_date_sort": "2025-06-05T00:00:00+03:00",
    "entry_date": "28.04.-18.05.",
    "location": "Rauma",
    "coordinates": [
      61.1289148,
      21.5039401
    ],
    "name": "NOU Rauma",
    "organizer": "SATAKUNNAN NOUTAJAKOIRAYHDISTYS RY",
    "official": {
      "name": "Heidi Höckert",
      "phone": "",
      "email": ""
    },
    "secretary": {
      "name": "Outi Lammila",
      "phone": "0503381120",
      "email": "outi.lammila@gmail.com"
    },
    "judges": [
      "Aaltonen Risto"
    ],
    "description": "Jäsenyyden tulee olla voimassa ilmoittautumisajan alkaessa.",
    "cost": 45,
    "cost_member": 40,
    "classes": []
  },
  {
    "type": "NOU",
    "levels": "N/A",
    "date": "06.06.2025",
    "date_sort": "2025-06-06T00:00:00+03:00",
    "end_date_sort": "2025-06-06T00:00:00+03:00",
    "entry_date": "19.05.-31.05.",
    "location": "Heinola",
    "coordinates": [
      61.2027188,
      26.031371
    ],
    "name": "Iltataipparit (ilm. klo 14.00, koe alkaa klo 15.00)",
    "organizer": "PÄIJÄT-HÄMEEN NOUTAJAKOIRAYHDISTYS",
    "official": {
      "name": "Jaana Koiranen",
      "phone": "",
      "email": ""
    },
    "secretary": {
      "name": "Kristiina Tynninen",
      "phone": "",
      "email": "kristiina.tynninen@gmail.com"
    },
    "judges": [
      "Nyman Tobina"
    ],
    "description": "Etusija järjestävän yhdistyksen jäsenillä sekä yhdistyksen kokeissa talkoilleilla. (Koe anotaan \"etusijalla järjestäjän kutsumat koirat\". Näitä voi olla 1/3 kokeen osallistujista.) Jäsenten osallistumismaksu 45 €. Koemaksu palautetaan koepaikan saaneille (arvonnasta tai varasijalta) vain Kennelliiton sääntöjen määräämästä syystä. Tällaisia syitä ovat koiran sairaus, ohjaajan sairaus tai narttukoiralla alkanut kiima.",
    "cost": 55,
    "cost_member": 45,
    "classes": []
  },
  {
    "type": "NOME-B",
    "levels": "ALO (La, Su)",
    "date": "06.-07.06.2025",
    "date_sort": "2025-06-06T21:00:00+00:00",
    "end_date_sort": "2025-06-07T21:00:00+00:00",
    "entry_date": "25.04.-25.05.",
    "location": "Lappeenranta",
    "coordinates": [
      61.0583417,
      28.1862293
    ],
    "name": "Cherry’s Cup (ALO)",
    "organizer": "KAAKON NOUTAJAKOIRAYHDISTYS RY",
    "official": {
      "name": "Tiina Sudensalmi",
      "phone": "0405156133",
      "email": "tiina.sudensalmi@live.com"
    },
    "secretary": {
      "name": "Pauliina Mäkelä",
      "phone": "0400494768",
      "email": "pamumakela74@gmail.com"
    },
    "judges": [
      "Silvennoinen Kari"
    ],
    "description": "",
    "cost": 50,
    "cost_member": 40,
    "classes": [
      {
        "date": "2025-06-06T21:00:00.000Z",
        "places": 15,
        "entries": 30,
        "members": 23,
        "judge": [
          {
            "name": "Silvennoinen Kari",
            "official": true,
            "id": 4100231
          }
        ],
        "state": "invited",
        "class": "ALO"
      },
      {
        "date": "2025-06-07T21:00:00.000Z",
        "places": 15,
        "entries": 30,
        "members": 23,
        "judge": [
          {
            "name": "Silvennoinen Kari",
            "official": true,
            "id": 4100231
          }
        ],
        "state": "invited",
        "class": "ALO"
      }
    ]
  },
  {
    "type": "NOU",
    "levels": "N/A",
    "date": "06.06.2025",
    "date_sort": "2025-06-06T21:00:00+00:00",
    "end_date_sort": "2025-06-06T21:00:00+00:00",
    "entry_date": "25.04.-16.05.",
    "location": "Rovaniemi ",
    "coordinates": [
      66.5025657,
      25.73122
    ],
    "name": "",
    "organizer": "LAPIN NUUSKUT R.Y.",
    "official": {
      "name": "Merja Tavajärvi-Mikkonen",
      "phone": "",
      "email": ""
    },
    "secretary": {
      "name": "Mari Tuunainen",
      "phone": "",
      "email": "ilmoittautumiset.nuuskut@gmail.com "
    },
    "judges": [
      "Vaarala Jarmo"
    ],
    "description": "Kokeeseen kutsuttujen (max 1/3 kokeen koiramäärästä) jälkeen etusija järjestävän yhdistyksen jäsenillä. Jäsenyys tulee olla voimassa ilmoittautumishetkellä. \n\nMaksupalautuksista pidätetään 5 € käsittelymaksu, jos ohjaaja peruu ilmoittautumisen. Sairastapauksissa maksupalautus lääkärintodistusta vastaan. Mikäli yhdistys peruu ilmoittautumisen (ei mahdu kokeeseen), osallistumismaksu palautetaan täysimääräisenä. \n\nIlmoittautumalla kokeeseen hyväksyn, että kokeen järjestämisen vastuuhenkilöt voivat käsitellä ilmoittamiani henkilötietoja ja julkaista niitä tarpeen mukaisesti.",
    "cost": 47,
    "cost_member": 42,
    "classes": []
  },
  {
    "type": "NOU",
    "levels": "N/A",
    "date": "06.06.2025",
    "date_sort": "2025-06-06T21:00:00+00:00",
    "end_date_sort": "2025-06-06T21:00:00+00:00",
    "entry_date": "25.04.-16.05.",
    "location": "Laukaa",
    "coordinates": [
      62.416667,
      25.95
    ],
    "name": "",
    "organizer": "KESKI-SUOMEN NOUTAJAKOIRAYHDISTYS RY.",
    "official": {
      "name": "Tanja Eklund",
      "phone": "",
      "email": ""
    },
    "secretary": {
      "name": "Maija Lappalainen",
      "phone": "",
      "email": "nome.maija@gmail.com"
    },
    "judges": [
      "Hietikko Vesa"
    ],
    "description": "",
    "cost": 48,
    "cost_member": 43,
    "classes": []
  },
  {
    "type": "NOU",
    "levels": "N/A",
    "date": "06.06.2025",
    "date_sort": "2025-06-06T21:00:00+00:00",
    "end_date_sort": "2025-06-06T21:00:00+00:00",
    "entry_date": "25.04.-18.05.",
    "location": "Vehmaa",
    "coordinates": [
      60.6866474,
      21.7152608
    ],
    "name": "Taipumuskoe",
    "organizer": "VAKKA-SUOMEN NOUTAJAT RY",
    "official": {
      "name": "",
      "phone": "",
      "email": ""
    },
    "secretary": {
      "name": "Mia Kataja",
      "phone": "",
      "email": "vsnnome@gmail.com"
    },
    "judges": [
      "Tuominen Petri"
    ],
    "description": "",
    "cost": 45,
    "cost_member": 40,
    "classes": []
  },
  {
    "type": "NOU",
    "levels": "N/A",
    "date": "06.06.2025",
    "date_sort": "2025-06-06T21:00:00+00:00",
    "end_date_sort": "2025-06-06T21:00:00+00:00",
    "entry_date": "25.04.-16.05.",
    "location": "Tampere",
    "coordinates": [
      61.4977929,
      23.7616372
    ],
    "name": "",
    "organizer": "PIRKANMAAN NOUTAJAKOIRAYHDISTYS RY",
    "official": {
      "name": "Jussi Palomäki",
      "phone": "",
      "email": ""
    },
    "secretary": {
      "name": "Susanna Jussila",
      "phone": "",
      "email": "sussu.jussila@gmail.com"
    },
    "judges": [
      "Majuri Pasi"
    ],
    "description": "Koiran tai omistajan sairastuessa osallistumismaksu palautetaan lääkärintodistusta vastaan. Narttukoiran juoksun alkaessa koemaksu palautetaan. Ilmoittautumalla hyväksyn, että kokeen järjestämisen vastuuhenkilöt voivat käsitellä ilmoittamiani henkilötietoja ja julkaista niitä tarpeen mukaisesti ja soveltuvin osin kokeen osallistuja- ja tulosluettelossa koepaikalla ja kokeeseen liittyvissä julkaisuissa internetissä tai muissa yhdistyksen medioissa. Lisätietoja Pirkanmaan Noutajakoirayhdistyksen tietosuojasta osoitteessa: www.pirkannuusku.net/yhdistys2/tietosuojaseloste/",
    "cost": 50,
    "cost_member": 45,
    "classes": []
  },
  {
    "type": "NOME-B",
    "levels": "ALO (La)",
    "date": "07.06.2025",
    "date_sort": "2025-06-07T00:00:00+03:00",
    "end_date_sort": "2025-06-07T00:00:00+03:00",
    "entry_date": "19.05.-01.06.",
    "location": "Heinola",
    "coordinates": [
      61.2027188,
      26.031371
    ],
    "name": "Tollerinome (ALO)",
    "organizer": "NOVASCOTIANNOUTAJAT RY",
    "official": {
      "name": "Jaana Koiranen",
      "phone": "",
      "email": ""
    },
    "secretary": {
      "name": "Malla Keränen",
      "phone": "",
      "email": "koetolleri@gmail.com"
    },
    "judges": [
      "Hiltunen Taru"
    ],
    "description": "Rotumestaruus. Etusija Novascotiannoutajat ry:n jäsenten omistamilla novascotiannoutajilla, jäsenillä ja yhdistyksen kokeissa talkoilleilla. Jäsenyys oltava voimassa ilmoittautumisajan alkaessa. Koemaksu palautetaan koepaikan saaneille (arvonnasta tai varasijalta) vain Kennelliiton sääntöjen määräämästä syystä. Tällaisia syitä ovat koiran sairaus, ohjaajan sairaus tai narttukoiralla alkanut kiima. Maksupalautuksesta vähennetään 5 € pankkikulu.",
    "cost": 55,
    "cost_member": 45,
    "classes": [
      {
        "date": "2025-06-06T21:00:00.000Z",
        "places": 15,
        "entries": 17,
        "members": 12,
        "judge": [
          {
            "name": "Hiltunen Taru",
            "official": true,
            "id": 736508
          }
        ],
        "state": "invited",
        "class": "ALO"
      }
    ]
  },
  {
    "type": "NOME-B",
    "levels": "ALO (La)",
    "date": "07.06.2025",
    "date_sort": "2025-06-07T00:00:00+03:00",
    "end_date_sort": "2025-06-07T00:00:00+03:00",
    "entry_date": "26.04.-17.05.",
    "location": "Renko",
    "coordinates": [
      60.8973271,
      24.2854098
    ],
    "name": "",
    "organizer": "KANTA-HÄMEEN NOUTAJAKOIRAYHDISTYS RY",
    "official": {
      "name": "Sari Lehtonen-Lammi",
      "phone": "0451165246",
      "email": "sari@someflow.fi"
    },
    "secretary": {
      "name": "Kirsi Launomaa",
      "phone": "040 725 5354",
      "email": "kirsi.launomaa@gmail.com"
    },
    "judges": [
      "Tenhunen Matti"
    ],
    "description": "",
    "cost": 50,
    "cost_member": 45,
    "classes": [
      {
        "date": "2025-06-06T21:00:00.000Z",
        "places": 15,
        "entries": 20,
        "members": 16,
        "judge": [
          {
            "name": "Tenhunen Matti",
            "official": true,
            "id": 881593
          }
        ],
        "state": "invited",
        "class": "ALO"
      }
    ]
  },
  {
    "type": "NOME-B",
    "levels": "ALO (La)",
    "date": "07.06.2025",
    "date_sort": "2025-06-07T00:00:00+03:00",
    "end_date_sort": "2025-06-07T00:00:00+03:00",
    "entry_date": "28.04.-25.05.",
    "location": "Liperi",
    "coordinates": [
      62.5314503,
      29.3872024
    ],
    "name": "",
    "organizer": "POHJOIS-KARJALAN NOUTAJAKOIRAYHDIST",
    "official": {
      "name": "Pirita Sainola",
      "phone": "",
      "email": "piritalassila@hotmail.com"
    },
    "secretary": {
      "name": "Helinä Kettunen",
      "phone": "",
      "email": "rais_u86@hotmail.com"
    },
    "judges": [
      "Puttonen Pasi"
    ],
    "description": "Etusija järjestävän yhdistyksen jäsenillä sekä yhdistyksen kokeissa talkoilleilla. (\"etusijalla järjestäjän kutsumat koirat\". Näitä voi olla 1/3 kokeen osallistujista.) Jäsenten osallistumismaksu 45 €, ei jäsenten 50 €. Koemaksu palautetaan koepaikan saaneille vain Kennelliiton sääntöjen määräämästä syystä. Tällaisia syitä ovat koiran sairaus, ohjaajan sairaus tai narttukoiralla alkanut kiima. Ohjaajan/omistajan peruessa ilmoittautumisen, pidätetään maksunpalautuksesta 4 € käsittelykulu. ",
    "cost": 50,
    "cost_member": 45,
    "classes": [
      {
        "date": "2025-06-06T21:00:00.000Z",
        "places": 15,
        "entries": 15,
        "members": 10,
        "judge": [
          {
            "name": "Särkänlahti Jari",
            "official": true,
            "id": 4055276
          },
          {
            "name": "Puttonen Pasi",
            "official": true,
            "id": 4053791
          }
        ],
        "state": "invited",
        "class": "ALO"
      }
    ]
  },
  {
    "type": "NOU",
    "levels": "N/A",
    "date": "07.06.2025",
    "date_sort": "2025-06-07T00:00:00+03:00",
    "end_date_sort": "2025-06-07T00:00:00+03:00",
    "entry_date": "28.04.-19.05.",
    "location": "Liperi",
    "coordinates": [
      62.5314503,
      29.3872024
    ],
    "name": "",
    "organizer": "POHJOIS-KARJALAN NOUTAJAKOIRAYHDIST",
    "official": {
      "name": "Pirita Sainola",
      "phone": "",
      "email": "piritalassila@hotmail.com"
    },
    "secretary": {
      "name": "Helinä Kettunen",
      "phone": "",
      "email": "rais_u86@hotmail.com"
    },
    "judges": [
      "Varis Taija"
    ],
